image_id,path,question,answer,difficulty
81SXWhTLzbL,31/31460aad.jpg,What adjective describes the design of the case?,Stylish,0
81SXWhTLzbL,31/31460aad.jpg,How many warranties does this cover have?,Zero,0
71zEkWy4U0L,d7/d7fd9ce0.jpg,What material is the back case?,Hard,2
71zEkWy4U0L,d7/d7fd9ce0.jpg,What is the design?,Stylish,0
71zEkWy4U0L,d7/d7fd9ce0.jpg,Which brand is the cover for?,Lenovo,1
71zEkWy4U0L,d7/d7fd9ce0.jpg,What kind of buttons have perfect cutouts?,Volume,0
71zEkWy4U0L,d7/d7fd9ce0.jpg,What is raised to life the screen?,Bezel,0
81oyuTf9C1L,80/80399eeb.jpg,What material is the mobile cover described as?,Hard,0
81oyuTf9C1L,80/80399eeb.jpg,What brand is the logo on the phone cover?,Motorola,0
81oyuTf9C1L,80/80399eeb.jpg,How many 'put' actions are mentioned in the description?,Two,0
81oyuTf9C1L,80/80399eeb.jpg,What feature is raised to lift the screen and camera?,Bezel,1
81oyuTf9C1L,80/80399eeb.jpg,What color is the phone case?,Yellow,0
61O9nqYQkjL,3c/3c05433d.jpg,What is the design of the phone case?,Water,1
61O9nqYQkjL,3c/3c05433d.jpg,What kind of fit does the case have?,Snug,0
61O9nqYQkjL,3c/3c05433d.jpg,What phone model is the case for?,K5,1
61O9nqYQkjL,3c/3c05433d.jpg,What is a physical feature the case protects?,Screen,0
61O9nqYQkjL,3c/3c05433d.jpg,What access does the case allow?,Buttons,0
713oAqS11RL,56/564624df.jpg,What is the primary shape on the phone case?,Heart,0
713oAqS11RL,56/564624df.jpg,Which brand is the case compatible with?,Samsung,0
713oAqS11RL,56/564624df.jpg,What material is the background printed to resemble?,Wood,1
713oAqS11RL,56/564624df.jpg,How many buttons are visible on the red plaid heart?,Three,0
713oAqS11RL,56/564624df.jpg,What color is the small heart design printed on the cloth?,Red,1
71pFkRMM+EL,3f/3fd6c360.jpg,What is the case designed for?,Mobile,1
71pFkRMM+EL,3f/3fd6c360.jpg,What is the product's material?,Hard,1
71pFkRMM+EL,3f/3fd6c360.jpg,What phone model does this case fit?,Gionee,0
71pFkRMM+EL,3f/3fd6c360.jpg,What adjective describes the design?,Stylish,0
71pFkRMM+EL,3f/3fd6c360.jpg,What colour is the paint stroke on the left?,Orange,0
31EzNn7zBpL,e0/e00bf34e.jpg,What material is the mattress topper composed of?,Foam,0
31EzNn7zBpL,e0/e00bf34e.jpg,What does the gel memory foam add?,Softness,0
31EzNn7zBpL,e0/e00bf34e.jpg,In what country is the product made?,USA,0
31EzNn7zBpL,e0/e00bf34e.jpg,What weight is the memory foam?,Four,0
31EzNn7zBpL,e0/e00bf34e.jpg,What percentage cooler does gel memory foam sleep?,Thirty-three,0
71JQRlre4aL,c2/c290c2aa.jpg,What is the color of the bands?,Black,1
71JQRlre4aL,c2/c290c2aa.jpg,What is the pillowcase size in inches?,30,5
71JQRlre4aL,c2/c290c2aa.jpg,How many pillowcases are included?,Two,0
71JQRlre4aL,c2/c290c2aa.jpg,What is the fitted sheet's length in inches?,80,0
71JQRlre4aL,c2/c290c2aa.jpg,What type of machine can wash them?,Washer,0
912TltFbGOL,a6/a6a17fb8.jpg,What is the net weight of the bag?,Twohundred,0
912TltFbGOL,a6/a6a17fb8.jpg,What spice does the bag contain?,Peppers,0
912TltFbGOL,a6/a6a17fb8.jpg,What word is printed in cursive on the bag?,Vedaka,0
912TltFbGOL,a6/a6a17fb8.jpg,What material is the smaller bag made of?,Burlap,0
912TltFbGOL,a6/a6a17fb8.jpg,What type of food norm is mentioned in the description?,Fssai,1
611NYoyh6lL,67/6773e6d4.jpg,Which phone model is this case designed for?,U20,0
611NYoyh6lL,67/6773e6d4.jpg,What adjective describes the case's fit?,Snug,0
611NYoyh6lL,67/6773e6d4.jpg,What color is the background of the phone case?,Black,0
611NYoyh6lL,67/6773e6d4.jpg,What type of ports have cut-outs?,Charging,1
611NYoyh6lL,67/6773e6d4.jpg,How many buttons are mentioned?,Volume,0
81MmfHFVCPL,4e/4ea781f3.jpg,What kind of device is protected by this cover?,Microsoft,1
81MmfHFVCPL,4e/4ea781f3.jpg,What type of material is the back cover?,Hard,0
81MmfHFVCPL,4e/4ea781f3.jpg,What adjective describes the design?,Stylish,1
81MmfHFVCPL,4e/4ea781f3.jpg,How many speakers are on the back of the phone?,Zero,1
81MmfHFVCPL,4e/4ea781f3.jpg,What is the apparent landscape feature shown?,Tree,1
712HyX1zetL,39/39e596d7.jpg,What letter is featured on the case?,G,0
712HyX1zetL,39/39e596d7.jpg,What material is the design trying to emulate?,Denim,0
712HyX1zetL,39/39e596d7.jpg,What brand of phone is this case compatible with?,Samsung,1
712HyX1zetL,39/39e596d7.jpg,What is lifted off flat surfaces?,Camera,1
712HyX1zetL,39/39e596d7.jpg,How many ports are mentioned?,Three,0
7100j+VbybL,38/38a82fda.jpg,What is the brand shown in the description?,Amazon,0
7100j+VbybL,38/38a82fda.jpg,What size is the pet house?,Large,0
7100j+VbybL,38/38a82fda.jpg,What color is the pet house?,White,0
7100j+VbybL,38/38a82fda.jpg,What structure provides shelter?,House,5
7100j+VbybL,38/38a82fda.jpg,What is sold by Amazon?,Pet,1
710IZcKmtNL,df/dff8685a.jpg,What closure type is the footwear?,Slip,0
710IZcKmtNL,df/dff8685a.jpg,What shape is the toe?,Round,0
710IZcKmtNL,df/dff8685a.jpg,What type of heel does the sandal have?,Flats,0
710IZcKmtNL,df/dff8685a.jpg,How many days is the warranty?,Ninety,0
710IZcKmtNL,df/dff8685a.jpg,What is the material listed as?,PU,1
612i2m6uKFL,ba/baf39a2a.jpg,What material is the pendant?,Gold,2
612i2m6uKFL,ba/baf39a2a.jpg,What shape is the pendant?,Circle,0
612i2m6uKFL,ba/baf39a2a.jpg,What is the purpose of the clasp?,Closure,1
612i2m6uKFL,ba/baf39a2a.jpg,Where was the item made?,Imported,2
612i2m6uKFL,ba/baf39a2a.jpg,What type of jewelry is displayed?,Necklace,0
71CFQdypYYL,d4/d40119d4.jpg,What secures the sandal around the ankle?,Buckle,0
71CFQdypYYL,d4/d40119d4.jpg,What is the general style of the shown footwear?,Sandal,1
71CFQdypYYL,d4/d40119d4.jpg,What material are the straps likely made from?,Leather,3
71CFQdypYYL,d4/d40119d4.jpg,What part of the foot is exposed in this design?,Toes,1
71CFQdypYYL,d4/d40119d4.jpg,What is the primary color of the sandal?,Brown,5
711nXdm+lZL,87/87fe42d6.jpg,What spice is used in the tomato sauce?,Masala,0
711nXdm+lZL,87/87fe42d6.jpg,What vegetable is paired with raita?,Cucumber,3
711nXdm+lZL,87/87fe42d6.jpg,What word describes the cooking speed?,Quick,0
711nXdm+lZL,87/87fe42d6.jpg,What kind of guarantee is given?,Freshness,1
711nXdm+lZL,87/87fe42d6.jpg,How many minutes to cook?,Thirty,0
61C6tuL5gbL,6c/6c06431c.jpg,What is the color of the tool bag's handle?,Grey,0
61C6tuL5gbL,6c/6c06431c.jpg,What tool is centrally placed with a black handle?,Hammer,0
61C6tuL5gbL,6c/6c06431c.jpg,What measurement device is shown with a yellow end?,Tape,5
61C6tuL5gbL,6c/6c06431c.jpg,What cutting tool is above the level?,Knife,0
61C6tuL5gbL,6c/6c06431c.jpg,What type of pliers are chrome colored?,Locking,0
91jJXH7WGZL,44/448126db.jpg,What color pattern covers the comforter?,Geometric,0
91jJXH7WGZL,44/448126db.jpg,What kind of bedding set is displayed?,Comforter,0
91jJXH7WGZL,44/448126db.jpg,What is the color of the sheets?,White,0
91jJXH7WGZL,44/448126db.jpg,How many layers are in the stacked comforter?,Three,0
91jJXH7WGZL,44/448126db.jpg,What material might be used in making these items?,Cotton,0
61vJsoRNwgL,0e/0e4a8cc6.jpg,What kind of object is pictured?,Sheet,0
61vJsoRNwgL,0e/0e4a8cc6.jpg,What is the apparent color of the object?,Beige,1
61vJsoRNwgL,0e/0e4a8cc6.jpg,What is the texture of the object seemingly like?,Smooth,0
61vJsoRNwgL,0e/0e4a8cc6.jpg,What is covering the sheet?,Nothing,0
61vJsoRNwgL,0e/0e4a8cc6.jpg,What general shape does the unfolded sheet resemble?,Rectangle,0
71rAUSlvfmL,7d/7da4b4d7.jpg,What material is the case made of?,Hard,1
71rAUSlvfmL,7d/7da4b4d7.jpg,Which brand phone is the case designed for?,Samsung,0
71rAUSlvfmL,7d/7da4b4d7.jpg,What season do the depicted leaves represent?,Autumn,0
71rAUSlvfmL,7d/7da4b4d7.jpg,What type of button cutouts are on the case?,Volume,0
71rAUSlvfmL,7d/7da4b4d7.jpg,What kind of bezel does the case feature?,Raised,1
91F4btwj7SL,39/397f671d.jpg,What material is the bean bag cover made from?,Leatherette,0
91F4btwj7SL,39/397f671d.jpg,How many years is the limited warranty against manufacturing defects?,One,1
91F4btwj7SL,39/397f671d.jpg,What kind of strap is featured?,Handle,0
91F4btwj7SL,39/397f671d.jpg,How much bean refill in kilograms is required at most?,2.5,0
91F4btwj7SL,39/397f671d.jpg,What color is the beanbag in the image?,Maroon,0
61umgAt5kgL,fc/fc373f4c.jpg,What material is the back case constructed from?,Hard,0
61umgAt5kgL,fc/fc373f4c.jpg,What is the brand name associated with this phone cover?,Micromax,1
61umgAt5kgL,fc/fc373f4c.jpg,How many speakers are visible on the back cover?,Zero,0
61umgAt5kgL,fc/fc373f4c.jpg,What design is printed on the case?,Flowers,0
61umgAt5kgL,fc/fc373f4c.jpg,Which specific Canvas Juice model is this case compatible with?,Q392,1
71BbOhfzB5L,ab/ab95252c.jpg,Which phone is the case designed for?,Samsung,1
71BbOhfzB5L,ab/ab95252c.jpg,What shape is featured prominently on the case?,Heart,0
71BbOhfzB5L,ab/ab95252c.jpg,What material are the ports made for?,Audio,1
71BbOhfzB5L,ab/ab95252c.jpg,What word describes the design?,Stylish,0
71BbOhfzB5L,ab/ab95252c.jpg,How many cameras are visible?,Two,1
71xyxtb5WyL,2f/2f498622.jpg,What brand is the phone case for?,Samsung,0
71xyxtb5WyL,2f/2f498622.jpg,What type of material is the case made of?,Hard,1
71xyxtb5WyL,2f/2f498622.jpg,What is displayed in the stylish design?,Flowers,0
71xyxtb5WyL,2f/2f498622.jpg,How many ports are mentioned in the description?,Three,0
71xyxtb5WyL,2f/2f498622.jpg,What is the case's thickness described as?,Slim,2
31YKuSwchaL,04/043d4e01.jpg,What color is the umbrella?,Green,0
31YKuSwchaL,04/043d4e01.jpg,What is the umbrella's grade?,Commercial,0
31YKuSwchaL,04/043d4e01.jpg,What material appears to be on the pole?,Wood,3
31YKuSwchaL,04/043d4e01.jpg,What characteristic is the umbrella designed for?,Strength,0
31YKuSwchaL,04/043d4e01.jpg,How many levels of fabric are visible at the center?,Three,1
71sqRhh1OGL,96/9678f8d8.jpg,Which brand of phone is this cover for?,Samsung,0
71sqRhh1OGL,96/9678f8d8.jpg,What shape predominates the design?,Hearts,5
71sqRhh1OGL,96/9678f8d8.jpg,What material is the cover made of?,Hard,3
71sqRhh1OGL,96/9678f8d8.jpg,What specific Samsung model is the cover for?,Galaxy,0
71sqRhh1OGL,96/9678f8d8.jpg,What is the design's style described as?,Stylish,0
61DUlCgyHpL,dc/dcd4560a.jpg,What type of juice is this?,Pressed,0
61DUlCgyHpL,dc/dcd4560a.jpg,What store's brand is this?,WholeFoods,0
61DUlCgyHpL,dc/dcd4560a.jpg,What flavor is this drink?,HawaiianPear,0
61DUlCgyHpL,dc/dcd4560a.jpg,What is listed before spinach on the bottle?,Kale,1
61DUlCgyHpL,dc/dcd4560a.jpg,How many fluid ounces are in the bottle?,16,0
71wpZZhOshL,93/93e8d363.jpg,What brand is the phone case compatible with?,Lephone,0
71wpZZhOshL,93/93e8d363.jpg,What type of port has a cutout?,Charging,0
71wpZZhOshL,93/93e8d363.jpg,What is lifted by the raised bezel?,Screen,0
71wpZZhOshL,93/93e8d363.jpg,What adjective describes the design?,Stylish,3
71wpZZhOshL,93/93e8d363.jpg,What is the pattern on the case?,Feather,0
61B-OGyUZSL,90/908f3927.jpg,Which brand is this phone case designed for?,Samsung,3
61B-OGyUZSL,90/908f3927.jpg,What is the leafâ€™s prominent color?,Yellow,1
61B-OGyUZSL,90/908f3927.jpg,What shape is cut out of the leaf?,Heart,0
61B-OGyUZSL,90/908f3927.jpg,How many cameras are visible on the phone case?,Three,0
61B-OGyUZSL,90/908f3927.jpg,What material is behind the leaf?,Wood,0
71D3HfyIY-L,7e/7e70be7b.jpg,What color dominates the background?,Green,0
71D3HfyIY-L,7e/7e70be7b.jpg,What is the design subject?,Flowers,0
71D3HfyIY-L,7e/7e70be7b.jpg,Which phone model is compatible?,Huawei,1
71D3HfyIY-L,7e/7e70be7b.jpg,What feature is raised?,Bezel,0
71D3HfyIY-L,7e/7e70be7b.jpg,Where are the perfect cut-outs?,Ports,0
71Q3lbQO6bL,d6/d6fd553a.jpg,What food preparation tool is pictured?,Masher,0
71Q3lbQO6bL,d6/d6fd553a.jpg,What color is the handle's accent?,Yellow,0
71Q3lbQO6bL,d6/d6fd553a.jpg,What is the material of the mashing head?,Plastic,0
71Q3lbQO6bL,d6/d6fd553a.jpg,What shape are the holes in the head?,Round,0
71Q3lbQO6bL,d6/d6fd553a.jpg,What food is typically mashed with this tool?,Potatoes,0
712kLv4cufL,9a/9aacd363.jpg,What color is the chevron pattern?,Golden,2
712kLv4cufL,9a/9aacd363.jpg,What brand of phone is the case designed for?,Lenovo,0
712kLv4cufL,9a/9aacd363.jpg,What type of material is the case made of?,Hard,1
712kLv4cufL,9a/9aacd363.jpg,What feature does the case offer for screen protection?,Bezel,0
712kLv4cufL,9a/9aacd363.jpg,How many volume buttons are mentioned?,Two,0
51fkzLb+L8L,a0/a0f4e360.jpg,What is the case compatible with?,OnePlus,0
51fkzLb+L8L,a0/a0f4e360.jpg,What is the back cover described as being?,Transparent,0
51fkzLb+L8L,a0/a0f4e360.jpg,What is the lip designed to protect?,Screen,0
51fkzLb+L8L,a0/a0f4e360.jpg,What does the phone case resist?,Scratches,0
51fkzLb+L8L,a0/a0f4e360.jpg,What feature does the cover have?,Electroplating,0
71MWCpZ5dEL,ed/edae6695.jpg,What brand of phone is the case for?,Meizu,1
71MWCpZ5dEL,ed/edae6695.jpg,What type of case is it?,Hard,0
71MWCpZ5dEL,ed/edae6695.jpg,What word is present near the bottom of the design?,Papa's,0
71MWCpZ5dEL,ed/edae6695.jpg,What feature is described as having perfect cutouts?,Volume,0
71MWCpZ5dEL,ed/edae6695.jpg,What color is the phone case's background?,White,0
916rS6fST2L,f2/f2ca58fb.jpg,What color is the fabric covering the bed?,Grey,0
916rS6fST2L,f2/f2ca58fb.jpg,"What is the time range needed for assembly, according to the description?",Hour,0
916rS6fST2L,f2/f2ca58fb.jpg,What is the warranty period offered?,Three,1
916rS6fST2L,f2/f2ca58fb.jpg,What material are the bed's legs made from?,Wood,0
916rS6fST2L,f2/f2ca58fb.jpg,What pattern is most descriptive of the fabric?,Solid,1
91rStr-DroL,31/31347f65.jpg,What color is the table?,Black,1
91rStr-DroL,31/31347f65.jpg,What item is on the bottom shelf?,Magazine,1
91rStr-DroL,31/31347f65.jpg,What is the table material?,Wood,2
91rStr-DroL,31/31347f65.jpg,How long is the warranty?,Three,0
91rStr-DroL,31/31347f65.jpg,What covers the floor?,Rug,1
91WanGdjb8L,5c/5cb78db8.jpg,What is the cover's material?,Leatherette,0
91WanGdjb8L,5c/5cb78db8.jpg,What is the cover's color?,Red,0
91WanGdjb8L,5c/5cb78db8.jpg,How many years is the warranty?,One,0
91WanGdjb8L,5c/5cb78db8.jpg,What keeps beans from spilling?,Zipper,1
91WanGdjb8L,5c/5cb78db8.jpg,What is the cover's width in centimeters?,116.99,3
71k00N5L-xL,37/37ef55a5.jpg,What kind of pasta is in the bag?,Fusilli,1
71k00N5L-xL,37/37ef55a5.jpg,What ingredient is the pasta made from?,Wheat,1
71k00N5L-xL,37/37ef55a5.jpg,What is absent in the pasta?,Cholesterol,0
71k00N5L-xL,37/37ef55a5.jpg,"What cooking time is recommended, in minutes?",Eleven,1
71k00N5L-xL,37/37ef55a5.jpg,How many grams is contained in a pack?,Fivehundred,0
71VxFziAmAL,9f/9f8794fa.jpg,What footwear type is visible?,Boot,0
71VxFziAmAL,9f/9f8794fa.jpg,What is the heel shape?,Block,1
71VxFziAmAL,9f/9f8794fa.jpg,What is the primary material's apparent texture?,Smooth,0
71VxFziAmAL,9f/9f8794fa.jpg,What color is the ankle elastic?,Brown,1
71VxFziAmAL,9f/9f8794fa.jpg,Where is the pull tab located?,Back,0
71vFa1gI79L,2b/2b125e98.jpg,What type of product is this?,Sunscreen,0
71vFa1gI79L,2b/2b125e98.jpg,What's the SPF level?,Fifty,1
71vFa1gI79L,2b/2b125e98.jpg,How many fluid ounces are in the bottle?,Three,1
71vFa1gI79L,2b/2b125e98.jpg,Is this reef friendly?,Octinoxate,0
71vFa1gI79L,2b/2b125e98.jpg,What company made this product?,Amazon,0
71Ipx0Pht4L,28/2871c94a.jpg,What brand of phone is the case designed for?,Huawei,0
71Ipx0Pht4L,28/2871c94a.jpg,"What word is below ""Stop"" on the case?",Dreaming,1
71Ipx0Pht4L,28/2871c94a.jpg,What type of material is the back case made of?,Hard,3
71Ipx0Pht4L,28/2871c94a.jpg,How many 'lite' are mentioned in the description?,One,0
71Ipx0Pht4L,28/2871c94a.jpg,Where are the cutouts located?,Ports,0
81Q+ErEpy6L,81/8161e754.jpg,Which phone is this case designed for?,Nokia,1
81Q+ErEpy6L,81/8161e754.jpg,What is the first word describing the case's fit?,Snug,0
81Q+ErEpy6L,81/8161e754.jpg,What is accessed with cut-outs?,Volume,0
81Q+ErEpy6L,81/8161e754.jpg,What is lifted off flat surfaces?,Screen,0
81Q+ErEpy6L,81/8161e754.jpg,What appearance does it display?,Stylish,0
81dP-IunhXL,72/7209262a.jpg,What brand is this phone case for?,Samsung,1
81dP-IunhXL,72/7209262a.jpg,What is the design pattern on the case?,Zentangle,0
81dP-IunhXL,72/7209262a.jpg,What type of material is the case?,Hard,1
81dP-IunhXL,72/7209262a.jpg,How many cutouts are mentioned?,Three,1
81dP-IunhXL,72/7209262a.jpg,What device model is this designed for?,J4,5
71lSe-gO2yL,dc/dc494199.jpg,What brand is this case made for,Samsung,0
71lSe-gO2yL,dc/dc494199.jpg,What phrase is written on the case,Girlboss,3
71lSe-gO2yL,dc/dc494199.jpg,What material does the case resemble,Wood,0
71lSe-gO2yL,dc/dc494199.jpg,How many USB ports are mentioned,One,1
71lSe-gO2yL,dc/dc494199.jpg,What color is the camera bezel,Gold,0
71OBUkHJpnL,ff/ff7c1c28.jpg,What material does the case resemble?,Wood,2
71OBUkHJpnL,ff/ff7c1c28.jpg,Which phone model is this case for?,Oppo,0
71OBUkHJpnL,ff/ff7c1c28.jpg,What feature protects the camera and screen?,Bezel,1
71OBUkHJpnL,ff/ff7c1c28.jpg,What year is the phone compatible with?,2020,0
71OBUkHJpnL,ff/ff7c1c28.jpg,How many cutouts are mentioned?,Three,0
81z3oSwUtpL,19/1998a984.jpg,Which brand is the phone case designed for?,Samsung,0
81z3oSwUtpL,19/1998a984.jpg,What characteristic expresses personality?,Design,0
81z3oSwUtpL,19/1998a984.jpg,What is lifted off a flat surface?,Screen,0
81z3oSwUtpL,19/1998a984.jpg,What type of fit does the case have?,Snug,3
81z3oSwUtpL,19/1998a984.jpg,What color appears prominently on the case?,Red,1
61+CtVE4v8L,5a/5a560ff2.jpg,What shape is the white portion?,Cylinder,1
61+CtVE4v8L,5a/5a560ff2.jpg,What color is the lower section?,Brown,0
61+CtVE4v8L,5a/5a560ff2.jpg,What material might the dark section resemble?,Wood,1
61+CtVE4v8L,5a/5a560ff2.jpg,How many buttons are visible?,Five,0
61+CtVE4v8L,5a/5a560ff2.jpg,What is the upper portion's main purpose?,Light,0
71n1YovlhEL,0d/0d090de9.jpg,What phone is this case designed for?,Phantom,0
71n1YovlhEL,0d/0d090de9.jpg,What buttons have cut-outs on the case?,Volume,1
71n1YovlhEL,0d/0d090de9.jpg,What is accessed besides buttons?,Audio,0
71n1YovlhEL,0d/0d090de9.jpg,What does the design express?,Personality,0
71n1YovlhEL,0d/0d090de9.jpg,How many phones is this case compatible with in the description?,One,1
714vnkDHbmL,76/76be2ae9.jpg,What is the color of the object?,Yellow,1
714vnkDHbmL,76/76be2ae9.jpg,What material is the object constructed from?,Nitrile,0
714vnkDHbmL,76/76be2ae9.jpg,What hazard does the ramp design prevent?,Tripping,0
714vnkDHbmL,76/76be2ae9.jpg,How should the object be cleaned?,Water,5
714vnkDHbmL,76/76be2ae9.jpg,What is the approximate thickness given in inches?,5/8,0
61-BW9NM9BL,4b/4bc0d943.jpg,How many straps are visible on the front of the shoe?,Three,0
61-BW9NM9BL,4b/4bc0d943.jpg,What is the heel's shape?,Stiletto,1
61-BW9NM9BL,4b/4bc0d943.jpg,What material is the shoe likely made of?,Leather,1
61-BW9NM9BL,4b/4bc0d943.jpg,What type of fastener secures the ankle strap?,Buckle,0
61-BW9NM9BL,4b/4bc0d943.jpg,What is the color of the shoe?,Beige,0
813eYWYZ2eL,c9/c9ff3d26.jpg,What brand phone is the case designed for?,Samsung,0
813eYWYZ2eL,c9/c9ff3d26.jpg,What word is prominently displayed on the case?,Alone,1
813eYWYZ2eL,c9/c9ff3d26.jpg,What are cut-outs designed for?,Buttons,0
813eYWYZ2eL,c9/c9ff3d26.jpg,What adjective describes the fit?,Snug,0
813eYWYZ2eL,c9/c9ff3d26.jpg,What kind of landscape is depicted?,Forest,2
91KNWVnIqLL,36/36c3f41d.jpg,What item is depicted?,Scarf,1
91KNWVnIqLL,36/36c3f41d.jpg,What is the primary color?,Blue,0
91KNWVnIqLL,36/36c3f41d.jpg,What kind of company is Amazon?,Retailer,0
91KNWVnIqLL,36/36c3f41d.jpg,What adorns the scarf's edges?,Fringe,0
91KNWVnIqLL,36/36c3f41d.jpg,What is the texture?,Woven,0
71+KMW6iPyL,f0/f0bf937c.jpg,What is the general shape of the lamp's arm?,Curved,0
71+KMW6iPyL,f0/f0bf937c.jpg,What material does the lamp appear to be made of?,Metal,5
71+KMW6iPyL,f0/f0bf937c.jpg,What is the color of the lamp?,Bronze,0
71+KMW6iPyL,f0/f0bf937c.jpg,Where is the light source located?,Shade,1
71+KMW6iPyL,f0/f0bf937c.jpg,What is the shape of the lamp's base?,Circle,0
71eAu1bh5iL,2e/2ebda110.jpg,What is the color of the necktie?,Black,1
71eAu1bh5iL,2e/2ebda110.jpg,What geometric shape borders the smaller squares?,Octagon,0
71eAu1bh5iL,2e/2ebda110.jpg,What is the general type of clothing accessory pictured?,Necktie,0
71eAu1bh5iL,2e/2ebda110.jpg,What pattern element is inside the octagons?,Square,0
71eAu1bh5iL,2e/2ebda110.jpg,What is the apparent visual texture?,Patterned,0
713R8uNN1hL,f4/f4e1cebf.jpg,What brand appears on the box?,Amazon,1
713R8uNN1hL,f4/f4e1cebf.jpg,What material are the gloves made from?,Nitrile,0
713R8uNN1hL,f4/f4e1cebf.jpg,What color are the gloves?,Blue,0
713R8uNN1hL,f4/f4e1cebf.jpg,What is the thickness measurement of these gloves?,9mil,0
713R8uNN1hL,f4/f4e1cebf.jpg,How many gloves are included?,50,1
71Qmul8J4lL,89/893a302c.jpg,What color is the background of the case?,Pink,1
71Qmul8J4lL,89/893a302c.jpg,Which brand name is written on the perfume bottles?,Chanel,0
71Qmul8J4lL,89/893a302c.jpg,For what phone brand is this case?,Asus,1
71Qmul8J4lL,89/893a302c.jpg,What material is this case?,Hard,0
71Qmul8J4lL,89/893a302c.jpg,How many camera lenses are visible on the phone case?,Two,0
71Cjm1vDJKL,91/9190ee31.jpg,What animal is featured on the case?,Lion,0
71Cjm1vDJKL,91/9190ee31.jpg,What color is the dominant background?,White,1
71Cjm1vDJKL,91/9190ee31.jpg,What is the case designed to protect?,Phone,1
71Cjm1vDJKL,91/9190ee31.jpg,Which brand of phone is this case for?,Samsung,0
71Cjm1vDJKL,91/9190ee31.jpg,What geometric shape is used to create the lion?,Polygon,1
81OsHswbk5L,73/73845694.jpg,What is the case's material?,Hard,0
81OsHswbk5L,73/73845694.jpg,Which brand of phone is this case for?,Nokia,0
81OsHswbk5L,73/73845694.jpg,What kind of design does it have?,Stylish,0
81OsHswbk5L,73/73845694.jpg,What part of the phone does the case cover?,Back,0
81OsHswbk5L,73/73845694.jpg,What does the case have cutouts for?,Ports,0
612bkWh4-AL,46/4697f0cc.jpg,How many pieces are in the package?,160,0
612bkWh4-AL,46/4697f0cc.jpg,What milligram amount is present in this gum?,Two,0
612bkWh4-AL,46/4697f0cc.jpg,What fruit flavor is listed?,Fruit,1
612bkWh4-AL,46/4697f0cc.jpg,What brand is mentioned in the image?,Basic,0
612bkWh4-AL,46/4697f0cc.jpg,What medical purpose is the gum used for?,Smoking,0
91K2mnHqGQL,bc/bc5c536e.jpg,What is the length of the pillow?,Twenty,1
91K2mnHqGQL,bc/bc5c536e.jpg,What material covers the pillow?,Polyester,1
91K2mnHqGQL,bc/bc5c536e.jpg,How many minutes can it be in dryer?,Twenty,3
91K2mnHqGQL,bc/bc5c536e.jpg,Where is the pillow manufactured?,States,0
91K2mnHqGQL,bc/bc5c536e.jpg,What shapes form the print?,Geometric,5
71InDndyOBL,fe/fe41ed06.jpg,What shape is the central stone?,Heart,0
71InDndyOBL,fe/fe41ed06.jpg,What color is the primary gemstone?,Blue,0
71InDndyOBL,fe/fe41ed06.jpg,What is the setting's color?,Silver,1
71InDndyOBL,fe/fe41ed06.jpg,What are the smaller stones surrounding the central one?,Crystals,0
71InDndyOBL,fe/fe41ed06.jpg,How many earrings are shown?,Two,0
713K6ZHdKNL,b0/b05ef343.jpg,What phone is this case designed for?,iPhone,0
713K6ZHdKNL,b0/b05ef343.jpg,What color is the right side of the case?,Red,3
713K6ZHdKNL,b0/b05ef343.jpg,What symbol is featured on the case?,Skull,2
713K6ZHdKNL,b0/b05ef343.jpg,What material allows access to ports?,Cutouts,1
713K6ZHdKNL,b0/b05ef343.jpg,What protects the screen?,Bezel,1
717HO2EzK+L,41/41635ae5.jpg,What phone model is this case for?,Lenovo,0
717HO2EzK+L,41/41635ae5.jpg,What adjective describes the case's back?,Hard,1
717HO2EzK+L,41/41635ae5.jpg,What color is the background of the case?,Black,0
717HO2EzK+L,41/41635ae5.jpg,"What is the apparent finish of the ""Girl Boss"" text?",Glitter,1
717HO2EzK+L,41/41635ae5.jpg,"How many words are in the slogan ""Girl Boss""?",Two,0
81--PxY7B+L,d4/d485fbc1.jpg,What is the primary material?,Mesh,0
81--PxY7B+L,d4/d485fbc1.jpg,What closure does the shoe utilize?,Slip,1
81--PxY7B+L,d4/d485fbc1.jpg,What shape is the toe?,Round,1
81--PxY7B+L,d4/d485fbc1.jpg,Where does the warranty originate?,Manufacturer,0
81--PxY7B+L,d4/d485fbc1.jpg,How many days is the warranty?,Ninety,0
813jGr-5x1L,0e/0efb6eff.jpg,What shape does this pasta resemble?,Barley,0
813jGr-5x1L,0e/0efb6eff.jpg,What weight is written on the box?,Sixteen,1
813jGr-5x1L,0e/0efb6eff.jpg,What flavor additive is not in the pasta?,Sodium,3
813jGr-5x1L,0e/0efb6eff.jpg,What is the company name at the top of the box?,Wholefoods,0
813jGr-5x1L,0e/0efb6eff.jpg,What ingredient is used to make this pasta?,Wheat,0
81qu-W7ws2L,bb/bb2d94ad.jpg,What is the material cut out for the audio port?,Ports,0
81qu-W7ws2L,bb/bb2d94ad.jpg,What brand of phone is the case designed for?,Lava,1
81qu-W7ws2L,bb/bb2d94ad.jpg,What is the design of the case described as?,Stylish,1
81qu-W7ws2L,bb/bb2d94ad.jpg,What kind of bezel does the case feature?,Raised,0
81qu-W7ws2L,bb/bb2d94ad.jpg,What color is the upper part of the artwork?,Yellow,1
8121QyBgYQL,79/79de2974.jpg,What brand is this case designed for?,Asus,0
8121QyBgYQL,79/79de2974.jpg,What material is the back cover described as?,Hard,0
8121QyBgYQL,79/79de2974.jpg,What version of Zenfone is this case for?,Laser,0
8121QyBgYQL,79/79de2974.jpg,What shape is on the case's design?,Smiley,0
8121QyBgYQL,79/79de2974.jpg,What type of ports does the case have cutouts for?,Charging,0
81dqg3ENLcL,f1/f1019edf.jpg,What material is the phone cover made of?,Hard,0
81dqg3ENLcL,f1/f1019edf.jpg,For which phone is this cover made?,Lenovo,0
81dqg3ENLcL,f1/f1019edf.jpg,What type of design does the cover have?,Stylish,0
81dqg3ENLcL,f1/f1019edf.jpg,What part of the phone does the cover protect?,Camera,0
81dqg3ENLcL,f1/f1019edf.jpg,What shape are the cutouts for the ports?,Perfect,0
