image_id,path,question,answer,difficulty
816WXQqPrlL,bf/bf2d24b6.jpg,What is the approximate shape of the object?,Rectangular,0
816WXQqPrlL,bf/bf2d24b6.jpg,What building structure does this resemble?,Dresser,0
711WKPG-mWL,3f/3f2e080c.jpg,What flower color is prominently displayed?,Purple,1
711WKPG-mWL,3f/3f2e080c.jpg,Which phone model is the case designed for?,S10e,0
711WKPG-mWL,3f/3f2e080c.jpg,What material is the case made of?,Hard,1
711WKPG-mWL,3f/3f2e080c.jpg,How many back cameras does the phone appear to have?,Three,1
711WKPG-mWL,3f/3f2e080c.jpg,What part of the phone is the case intended to protect?,Back,1
51jNPqpcc-L,0a/0ae7a65b.jpg,What shape are the visible parts of the earrings?,Spherical,1
51jNPqpcc-L,0a/0ae7a65b.jpg,What is the approximate number of earrings pictured?,Two,0
51jNPqpcc-L,0a/0ae7a65b.jpg,What is the apparent color of the earring's surface?,Golden,1
51jNPqpcc-L,0a/0ae7a65b.jpg,What is the jewelry classification?,Earrings,0
51jNPqpcc-L,0a/0ae7a65b.jpg,What part of the earring goes through the ear?,Post,0
717r660Ep7L,4f/4f99526b.jpg,What is the cover designed for?,Motorola,0
717r660Ep7L,4f/4f99526b.jpg,What type of ports have cut-outs?,Charging,1
717r660Ep7L,4f/4f99526b.jpg,What adjective describes the cover's fit?,Snug,1
717r660Ep7L,4f/4f99526b.jpg,What is lifted off flat surfaces?,Camera,0
717r660Ep7L,4f/4f99526b.jpg,What is expressed by the design?,Personality,0
61aRecx4PPL,78/78897819.jpg,What is the central gem type?,Zirconia,0
61aRecx4PPL,78/78897819.jpg,What general shape is the primary stone?,Square,0
61aRecx4PPL,78/78897819.jpg,What is the metal's likely color?,Silver,1
61aRecx4PPL,78/78897819.jpg,What adjective describes the overall style?,Ornate,0
61aRecx4PPL,78/78897819.jpg,How many rings are visible?,Two,1
91dI2CfO-fS,ab/ab36632f.jpg,What material is the bucket made of?,Iron,0
91dI2CfO-fS,ab/ab36632f.jpg,What is the bucket's finish?,Copper,0
91dI2CfO-fS,ab/ab36632f.jpg,Where are the artisans from?,India,0
91dI2CfO-fS,ab/ab36632f.jpg,What is the height of the bucket?,19.4,0
91dI2CfO-fS,ab/ab36632f.jpg,What does the bucket store?,Hose,0
61ixAXjdP-L,12/1243c5ee.jpg,What animal is featured on the phone case?,Rabbit,0
61ixAXjdP-L,12/1243c5ee.jpg,What color is the phone case background?,Pink,1
61ixAXjdP-L,12/1243c5ee.jpg,Which model is the phone case for?,Zenfone,1
61ixAXjdP-L,12/1243c5ee.jpg,What material is the back cover made of?,Hard,0
61ixAXjdP-L,12/1243c5ee.jpg,What physical port is explicitly mentioned in the description?,Audio,0
81U1FAdeczL,a1/a10829a4.jpg,What flavor is the Pasta Sauce?,Garlic,0
81U1FAdeczL,a1/a10829a4.jpg,What type of market sells this?,Foods,1
81U1FAdeczL,a1/a10829a4.jpg,What country is this product from?,USA,3
81U1FAdeczL,a1/a10829a4.jpg,What is the net weight in ounces?,25,0
81U1FAdeczL,a1/a10829a4.jpg,What is the color of the lid?,Black,0
61kFvkMueML,2c/2c29217c.jpg,What shape is in the center?,Heart,1
61kFvkMueML,2c/2c29217c.jpg,What material is the heart likely made of?,Diamond,0
61kFvkMueML,2c/2c29217c.jpg,What color is the phone case?,Blue,0
61kFvkMueML,2c/2c29217c.jpg,What is the brand of compatible phones?,Realme,0
61kFvkMueML,2c/2c29217c.jpg,What feature is raised for screen protection?,Bezel,0
81rDMTvoeIL,6c/6c3045c2.jpg,What brand distributes this cable?,Amazon,0
81rDMTvoeIL,6c/6c3045c2.jpg,What is the USB version?,Three,0
81rDMTvoeIL,6c/6c3045c2.jpg,What is the cable length in feet?,Six,0
81rDMTvoeIL,6c/6c3045c2.jpg,What material are the connectors plated with?,Gold,0
81rDMTvoeIL,6c/6c3045c2.jpg,What is the maximum data throughput in Gbps?,Four,1
81Ze604E6pL,74/747e849d.jpg,What material is the frame made of?,Plywood,0
81Ze604E6pL,74/747e849d.jpg,What is the color of the headboard?,Pearl,3
81Ze604E6pL,74/747e849d.jpg,How long is the warranty period?,Three,1
81Ze604E6pL,74/747e849d.jpg,What is the depth of the headboard in inches?,Eleven,3
81Ze604E6pL,74/747e849d.jpg,How many minutes does assembly take?,Fifteen,0
71smG8ePS1L,6b/6b870c65.jpg,What is the targeted phone model?,Realme,0
71smG8ePS1L,6b/6b870c65.jpg,What shape does the design include?,Smile,0
71smG8ePS1L,6b/6b870c65.jpg,What color is the case?,Blue,0
71smG8ePS1L,6b/6b870c65.jpg,Where are there cut-outs?,Ports,1
71smG8ePS1L,6b/6b870c65.jpg,How would you describe the design?,Stylish,1
61yS6pJ3OOL,ec/ece47b0f.jpg,What is the material of the board's legs?,Metallic,1
61yS6pJ3OOL,ec/ece47b0f.jpg,What is the cover made of?,Cotton,1
61yS6pJ3OOL,ec/ece47b0f.jpg,What is the warranty duration in months?,Six,1
61yS6pJ3OOL,ec/ece47b0f.jpg,What shape is the front of the board?,Curved,1
61yS6pJ3OOL,ec/ece47b0f.jpg,How many centimeters is the height of the accessory?,Ninety,0
71lpRZShHAL,1f/1f5f5b97.jpg,What material is the bow made of?,Velvet,0
71lpRZShHAL,1f/1f5f5b97.jpg,How many inches tall is the heel?,Three,1
71lpRZShHAL,1f/1f5f5b97.jpg,Where is the knot located?,Vamp,0
71lpRZShHAL,1f/1f5f5b97.jpg,What does the sandal wrap around?,Ankle,1
71lpRZShHAL,1f/1f5f5b97.jpg,What is the occasion for this sandal?,Event,0
81uxsuxqSLL,ad/ad17641c.jpg,What is the material of the curtain?,Polyester,0
81uxsuxqSLL,ad/ad17641c.jpg,How many eyelets are there per piece?,Eight,0
81uxsuxqSLL,ad/ad17641c.jpg,What kind of light does the curtain block?,Sunlight,0
81uxsuxqSLL,ad/ad17641c.jpg,How many layers are there in the fabric?,Three,0
81uxsuxqSLL,ad/ad17641c.jpg,What is the color of the curtain?,Brown,1
71YZvfqOcKL,a8/a833752d.jpg,What brand phone is the case designed for?,Motorola,0
71YZvfqOcKL,a8/a833752d.jpg,What size phone is this case intended for?,Plus,1
71YZvfqOcKL,a8/a833752d.jpg,What color is the bezel raised to protect the screen?,Transparent,1
71YZvfqOcKL,a8/a833752d.jpg,What type of accessory is featured in the image?,Case,2
71YZvfqOcKL,a8/a833752d.jpg,What design covers the phone case?,Abstract,1
81Dfz9AOw7L,e6/e6248408.jpg,What material is the back case made of?,Hard,1
81Dfz9AOw7L,e6/e6248408.jpg,Which phone is the case designed for?,Samsung,0
81Dfz9AOw7L,e6/e6248408.jpg,What is the cover's style?,Stylish,0
81Dfz9AOw7L,e6/e6248408.jpg,What buttons have cutouts?,Volume,0
81Dfz9AOw7L,e6/e6248408.jpg,What type of surface does the bezel protect?,Flat,1
71gEMajdl7L,c8/c86eb7ea.jpg,What is the product type?,Sugar,0
71gEMajdl7L,c8/c86eb7ea.jpg,What company distributes this product?,WholeFoods,0
71gEMajdl7L,c8/c86eb7ea.jpg,What is the source of the sugar?,Cane,5
71gEMajdl7L,c8/c86eb7ea.jpg,What type of certification does the product have?,Kosher,2
71gEMajdl7L,c8/c86eb7ea.jpg,How many colors are used for the circles on the bag?,Three,0
817PhpM-uML,60/60241904.jpg,What snack is paired with peanuts?,Corn,0
817PhpM-uML,60/60241904.jpg,Where is this product from?,Canada,0
817PhpM-uML,60/60241904.jpg,What type of bag is this?,Resealable,0
817PhpM-uML,60/60241904.jpg,What flavor of peanuts are included?,Cajun,0
817PhpM-uML,60/60241904.jpg,"What word is prominently displayed above ""Snack Mix""?",Pub,0
51vvd3fljnL,82/8277dc26.jpg,What phone is the case designed for?,Huawei,1
51vvd3fljnL,82/8277dc26.jpg,How is the design printed?,Embossed,0
51vvd3fljnL,82/8277dc26.jpg,What is the color of the upper portion of the case back?,Black,0
51vvd3fljnL,82/8277dc26.jpg,Where are the cutouts for?,Buttons,0
51vvd3fljnL,82/8277dc26.jpg,What does the raised bezel protect?,Screen,0
71ZDLolQPfL,9f/9ff63205.jpg,What is the primary material of the shoe?,Cotton,0
71ZDLolQPfL,9f/9ff63205.jpg,What toe style is featured?,Round,0
71ZDLolQPfL,9f/9ff63205.jpg,How many days does the warranty last?,Ninety,0
71ZDLolQPfL,9f/9ff63205.jpg,What type of closure does the shoe use?,Lace-up,1
71ZDLolQPfL,9f/9ff63205.jpg,Who provides the warranty?,Manufacturer,3
81BxcW+91EL,cd/cd9defdb.jpg,What is the frame material?,Metal,0
81BxcW+91EL,cd/cd9defdb.jpg,What is the seat covering's shade?,Neutral,1
81BxcW+91EL,cd/cd9defdb.jpg,What is the overall width?,Eighteen,0
81BxcW+91EL,cd/cd9defdb.jpg,What support type is used?,H-spreader,1
81BxcW+91EL,cd/cd9defdb.jpg,How long is the warranty?,Year,1
71ymFRVtgEL,7e/7e127e97.jpg,What brand is the mobile phone case designed for?,LG,1
71ymFRVtgEL,7e/7e127e97.jpg,What material is the back cover described as being?,Hard,0
71ymFRVtgEL,7e/7e127e97.jpg,What type of print is on the case?,Printed,0
71ymFRVtgEL,7e/7e127e97.jpg,Which part has perfect cutouts according to the description?,Buttons,0
71ymFRVtgEL,7e/7e127e97.jpg,What shape are the colorful designs?,Circles,0
71HeN-cb4NL,2d/2d914ed4.jpg,What material primarily composes the footwear?,Fur,2
71HeN-cb4NL,2d/2d914ed4.jpg,What is the general color of the slipper?,Peach,0
71HeN-cb4NL,2d/2d914ed4.jpg,What item of clothing is depicted?,Slipper,2
71HeN-cb4NL,2d/2d914ed4.jpg,What is the texture of the displayed object?,Fuzzy,0
71HeN-cb4NL,2d/2d914ed4.jpg,How many slippers are visible?,One,0
71XB1OYZPcL,38/384fee90.jpg,What material is the case made of?,Hard,1
71XB1OYZPcL,38/384fee90.jpg,Which phone model is this case designed for?,Oppo,0
71XB1OYZPcL,38/384fee90.jpg,What is the dominant color of the phone case?,Orange,1
71XB1OYZPcL,38/384fee90.jpg,What shape does the chain resemble?,Six,1
71XB1OYZPcL,38/384fee90.jpg,Where are there cutouts?,Ports,1
61uCC9S84eL,27/272564e2.jpg,What fruit's color is the phone case?,Yellow,1
61uCC9S84eL,27/272564e2.jpg,Which phone is the case designed for?,iPhone,0
61uCC9S84eL,27/272564e2.jpg,What physical feature is featured prominently in the design?,Beard,0
61uCC9S84eL,27/272564e2.jpg,What quality describes the fit of the case?,Snug,0
61uCC9S84eL,27/272564e2.jpg,"What action is described as ""easy"" regarding the case?",Removal,1
919V10c3pbL,74/745a9ea8.jpg,What is the product's country of origin?,Canada,1
919V10c3pbL,74/745a9ea8.jpg,"What ingredient is noted on the packaging that contains ""nut""?",Walnuts,0
919V10c3pbL,74/745a9ea8.jpg,How many bars are shown?,Five,1
919V10c3pbL,74/745a9ea8.jpg,What is the brand name printed on the bar?,Amazon,0
919V10c3pbL,74/745a9ea8.jpg,What measurement of weight is listed on the packaging?,Ounce,5
51uqdpyXSmL,ea/ea2b5b18.jpg,Which brand is the phone case compatible with?,Xiaomi,1
51uqdpyXSmL,ea/ea2b5b18.jpg,What feature does the design express?,Personality,1
51uqdpyXSmL,ea/ea2b5b18.jpg,What type of bezel is featured?,Raised,0
51uqdpyXSmL,ea/ea2b5b18.jpg,How many cameras are visible?,One,1
51uqdpyXSmL,ea/ea2b5b18.jpg,What is the color of the background?,Yellow,1
71PhYwUNs6L,b0/b032fe7a.jpg,What is the color of the stone?,Blue,0
71PhYwUNs6L,b0/b032fe7a.jpg,What shape is the main stone?,Oval,1
71PhYwUNs6L,b0/b032fe7a.jpg,What metal is the knot made of?,Gold,0
71PhYwUNs6L,b0/b032fe7a.jpg,What type of stone are the small accents?,Diamonds,0
71PhYwUNs6L,b0/b032fe7a.jpg,What metal is indicated on the ring?,Silver,0
61OnkGVhMWL,35/3595924e.jpg,What color is the carrier?,Grey,1
61OnkGVhMWL,35/3595924e.jpg,What size is the carrier?,Large,0
61OnkGVhMWL,35/3595924e.jpg,What type of animal is the carrier for?,Pet,0
61OnkGVhMWL,35/3595924e.jpg,What brand is shown?,Amazon,0
61OnkGVhMWL,35/3595924e.jpg,What is the carrierâ€™s material?,Soft-Sided,5
81jntaDz5VL,34/347b9cc0.jpg,What color is the sole of the shoe?,White,0
81jntaDz5VL,34/347b9cc0.jpg,What material is the outer made of?,Mesh,0
81jntaDz5VL,34/347b9cc0.jpg,What type of toe does the shoe have?,Round,2
81jntaDz5VL,34/347b9cc0.jpg,How many days is the warranty?,Thirty,1
81jntaDz5VL,34/347b9cc0.jpg,What closure does this shoe utilize?,Lace-Up,0
71BlA8nfmvL,3d/3d1eb18f.jpg,What device is this a case for?,Stylus,1
71BlA8nfmvL,3d/3d1eb18f.jpg,What material is the case made of?,Hard,0
71BlA8nfmvL,3d/3d1eb18f.jpg,How is the design applied to the case?,Printed,2
71BlA8nfmvL,3d/3d1eb18f.jpg,What brand of phone is the case designed for?,LG,0
71BlA8nfmvL,3d/3d1eb18f.jpg,What kind of buttons are mentioned?,Volume,0
91RxxoucOEL,8a/8ac8f541.jpg,What volume is the relish?,10FL_OZ,1
91RxxoucOEL,8a/8ac8f541.jpg,Where is this relish produced?,Mexico,1
91RxxoucOEL,8a/8ac8f541.jpg,What descriptor is given to the relish flavor?,Sweet,1
91RxxoucOEL,8a/8ac8f541.jpg,What type of market sells this item?,WholeFoods,1
91RxxoucOEL,8a/8ac8f541.jpg,Is this product certified?,Organic,0
711F5dYBCWL,b1/b108ec6f.jpg,Which brand of phone is the case for?,Samsung,1
711F5dYBCWL,b1/b108ec6f.jpg,What is the case's material?,Hard,1
711F5dYBCWL,b1/b108ec6f.jpg,What floral design is featured?,Roses,1
711F5dYBCWL,b1/b108ec6f.jpg,How is the case described?,Stylish,0
711F5dYBCWL,b1/b108ec6f.jpg,What phone model is this case designed for?,J7,2
71CTVxBQ7cL,d1/d100a913.jpg,What material is the upper made of?,Suede,0
71CTVxBQ7cL,d1/d100a913.jpg,What type of back does the shoe have?,Slingback,0
71CTVxBQ7cL,d1/d100a913.jpg,What material is the outsole made of?,Woven,1
71CTVxBQ7cL,d1/d100a913.jpg,What is the overall type of footwear?,Espadrille,0
71CTVxBQ7cL,d1/d100a913.jpg,What is the sole made from?,Rubber,1
616ShxxtnFL,e3/e3c311e3.jpg,What shape is the center of the earring?,Oval,1
616ShxxtnFL,e3/e3c311e3.jpg,What color are the stones surrounding the center?,Blue,0
616ShxxtnFL,e3/e3c311e3.jpg,What material is the post made of?,Metal,0
616ShxxtnFL,e3/e3c311e3.jpg,How many points does each earring have?,Ten,0
616ShxxtnFL,e3/e3c311e3.jpg,What is the general type of jewelry?,Earrings,0
81SX9ze-SgL,a9/a91d9f49.jpg,What finish does the wardrobe have,Classic,0
81SX9ze-SgL,a9/a91d9f49.jpg,What material is the construction made of,Chipboard,0
81SX9ze-SgL,a9/a91d9f49.jpg,What measurement is listed at 51 cm,Dimension,0
81SX9ze-SgL,a9/a91d9f49.jpg,What kind of foil is used,Oak,0
81SX9ze-SgL,a9/a91d9f49.jpg,How many people for assembly,Two,0
81MPjbfxSyL,72/728adcbd.jpg,What percent of the paper towels are recycled?,Hundred,0
81MPjbfxSyL,72/728adcbd.jpg,What brand sells the paper towels?,Wholefoods,1
81MPjbfxSyL,72/728adcbd.jpg,What characteristic does the packaging claim?,Strength,0
81MPjbfxSyL,72/728adcbd.jpg,In what country are the paper towels produced?,USA,1
81MPjbfxSyL,72/728adcbd.jpg,What is missing from the paper towels' composition?,Fragrance,0
81mSTLny+dL,07/074fd668.jpg,What color is the finish?,Black,1
81mSTLny+dL,07/074fd668.jpg,What shape are the internal supports?,Diamond,0
81mSTLny+dL,07/074fd668.jpg,What material is the tabletop made of?,MDF,1
81mSTLny+dL,07/074fd668.jpg,How many bottles does it hold?,Twenty-three,1
81mSTLny+dL,07/074fd668.jpg,What is the height in centimeters?,Sixty-eight,2
71QYa+tFPfL,75/755d8c0e.jpg,What phone is the case designed for?,Infinix,0
71QYa+tFPfL,75/755d8c0e.jpg,What design feature is on the back of the case?,Hearts,1
71QYa+tFPfL,75/755d8c0e.jpg,What material is the case not mentioned being made of?,Leather,0
71QYa+tFPfL,75/755d8c0e.jpg,How many camera holes are present on the top of the case?,Three,5
71QYa+tFPfL,75/755d8c0e.jpg,What is described as being lifted off a flat surface by the case?,Camera,0
71dMfZVR1cL,0b/0b7a1702.jpg,"What phrase is above ""Mommy's World?""","""Daddy's girl""",1
71dMfZVR1cL,0b/0b7a1702.jpg,For what brand of phone is this a snug fit?,10.or,1
71dMfZVR1cL,0b/0b7a1702.jpg,What kind of ports have perfect cutouts?,Charging,1
71dMfZVR1cL,0b/0b7a1702.jpg,What part is raised to lift the screen?,Bezel,0
71dMfZVR1cL,0b/0b7a1702.jpg,What aspect is used to express your personality?,Design,1
81sYQ27WY8L,e4/e430e490.jpg,Which smartphone is this case designed for?,Z80,1
81sYQ27WY8L,e4/e430e490.jpg,What kind of cut-outs are present on the case?,Volume,0
81sYQ27WY8L,e4/e430e490.jpg,What adjective describes the design of this case?,Stylish,1
81sYQ27WY8L,e4/e430e490.jpg,What is raised to protect the screen?,Bezel,0
81sYQ27WY8L,e4/e430e490.jpg,What liquid is represented on the case's design?,Water,0
71gO8QWpGbL,0e/0edfafa4.jpg,What is the color of the binder?,Blue,0
71gO8QWpGbL,0e/0edfafa4.jpg,How many rings does the binder have?,Three,0
71gO8QWpGbL,0e/0edfafa4.jpg,How many sheets can the binder hold?,120,0
71gO8QWpGbL,0e/0edfafa4.jpg,What shape are the rings?,Round,1
71gO8QWpGbL,0e/0edfafa4.jpg,What is the binder spine made of?,Polypropylene,1
71BqxxCmFmL,cd/cd475893.jpg,What style of shoe is displayed?,Maryjane,0
71BqxxCmFmL,cd/cd475893.jpg,What color is the shoe itself?,Yellow,0
71BqxxCmFmL,cd/cd475893.jpg,What fastens the shoe closed?,Velcro,0
71BqxxCmFmL,cd/cd475893.jpg,What type of decoration is on the strap?,Flower,0
71BqxxCmFmL,cd/cd475893.jpg,How many straps are visible on the shoe?,One,0
616hhkMW2JL,a9/a96311a8.jpg,What is the primary color of the phone case?,Orange,0
616hhkMW2JL,a9/a96311a8.jpg,What type of material is the back cover made of?,Hard,0
616hhkMW2JL,a9/a96311a8.jpg,For what brand of phone is this case designed?,Asus,1
616hhkMW2JL,a9/a96311a8.jpg,What is located on the upper left corner of the case?,Camera,1
616hhkMW2JL,a9/a96311a8.jpg,What material forms the shape of the numeral 1?,Chain,0
71Zr5Y2132L,89/89d64e31.jpg,What phone brand is the case designed for?,Samsung,1
71Zr5Y2132L,89/89d64e31.jpg,What is the pattern color?,White,0
71Zr5Y2132L,89/89d64e31.jpg,What kind of buttons have perfect cutouts?,Volume,1
71Zr5Y2132L,89/89d64e31.jpg,What kind of bezel is present?,Raised,0
71Zr5Y2132L,89/89d64e31.jpg,What type of case is it?,Hard,1
71O4HP+RhtL,be/be75bb01.jpg,What material is the phone case?,Hard,3
71O4HP+RhtL,be/be75bb01.jpg,Which phone model is the case designed for?,Lenovo,0
71O4HP+RhtL,be/be75bb01.jpg,What is the dominant color of the mushroom's cap?,Red,1
71O4HP+RhtL,be/be75bb01.jpg,What is the case's warranty status?,,0
71O4HP+RhtL,be/be75bb01.jpg,What part of the phone does the case cover?,Back,1
81iuGL1slcL,93/93d1fcf9.jpg,What is embroidered on the left chest?,Kindle,0
81iuGL1slcL,93/93d1fcf9.jpg,What type of fit does the shirt have?,Golf,1
81iuGL1slcL,93/93d1fcf9.jpg,How many buttons are on the polo?,Three,1
81iuGL1slcL,93/93d1fcf9.jpg,of the shirt?,Polyester,1
81iuGL1slcL,93/93d1fcf9.jpg,Where are the side vents located?,Hem,0
71hg6svJdWL,71/71749d70.jpg,What material is the back cover made of?,Hard,0
71hg6svJdWL,71/71749d70.jpg,What brand of phone case is this?,Xiaomi,0
71hg6svJdWL,71/71749d70.jpg,What is the phone model compatible with?,Redmi,0
71hg6svJdWL,71/71749d70.jpg,What characteristic is mentioned about the ports?,Cutouts,2
71hg6svJdWL,71/71749d70.jpg,What adjective describes the case's style?,Stylish,0
71GkLicSjcL,09/0943bfae.jpg,What is the fit of the case?,Snug,0
71GkLicSjcL,09/0943bfae.jpg,What phone is the case compatible with?,Poco,0
71GkLicSjcL,09/0943bfae.jpg,What is the case's design?,Stylish,0
71GkLicSjcL,09/0943bfae.jpg,What do the raised bezels protect?,Camera,1
71GkLicSjcL,09/0943bfae.jpg,What feature does the product lack?,Warranty,0
710AB7aRQAL,15/154dc2ad.jpg,What color is the case?,Orange,0
710AB7aRQAL,15/154dc2ad.jpg,Which brand phone is this case designed for?,Samsung,0
710AB7aRQAL,15/154dc2ad.jpg,How many years warranty does the product have?,Zero,0
710AB7aRQAL,15/154dc2ad.jpg,What material is the case made of?,Hard,1
710AB7aRQAL,15/154dc2ad.jpg,What type of pattern is on the case?,Chain,0
61X+-b96yrL,e6/e669a562.jpg,What is the background color?,Blue,0
61X+-b96yrL,e6/e669a562.jpg,What is the subject's primary function?,Protection,0
61X+-b96yrL,e6/e669a562.jpg,What device is this compatible with?,Poco,1
61X+-b96yrL,e6/e669a562.jpg,What shape is a common pattern element?,Bow,0
61X+-b96yrL,e6/e669a562.jpg,What design feature lifts the camera?,Bezel,0
81XMqULF43L,1a/1a13aec5.jpg,What is the shoe material?,PU,1
81XMqULF43L,1a/1a13aec5.jpg,What kind of shoes are they?,Formal,0
81XMqULF43L,1a/1a13aec5.jpg,How high is the heel?,One,0
81XMqULF43L,1a/1a13aec5.jpg,What style toe do they have?,Round,0
81XMqULF43L,1a/1a13aec5.jpg,How long is the product warranty?,Thirty,1
81do0ESDQUL,94/9406554b.jpg,What color is the ink?,Gold,1
81do0ESDQUL,94/9406554b.jpg,What is the depicted subject?,Liberty,0
81do0ESDQUL,94/9406554b.jpg,What year is visible on the sketch?,1875,0
81do0ESDQUL,94/9406554b.jpg,What is the frame's color?,White,0
81do0ESDQUL,94/9406554b.jpg,What height is given?,Inches,0
71Az9fdTR0L,10/10be5fa1.jpg,What phone model is the case designed for?,Vivo,0
71Az9fdTR0L,10/10be5fa1.jpg,What shape surrounds the woman's silhouette?,Heart,1
71Az9fdTR0L,10/10be5fa1.jpg,What color is the phone case?,Black,0
71Az9fdTR0L,10/10be5fa1.jpg,What specific buttons have cutouts on the phone case?,Volume,0
71Az9fdTR0L,10/10be5fa1.jpg,What feature is raised to lift the screen?,Bezel,3
61kEBw+cjcL,c5/c5fe4174.jpg,What model phone is this case designed for?,Redmi,0
61kEBw+cjcL,c5/c5fe4174.jpg,What feature protects the screen and camera?,Bezel,0
61kEBw+cjcL,c5/c5fe4174.jpg,What process is used for the design's printing?,Embossed,0
61kEBw+cjcL,c5/c5fe4174.jpg,What material does the case protect from?,Scratches,1
61kEBw+cjcL,c5/c5fe4174.jpg,What time is displayed on the phone's screen?,Eight,1
31wBeaL487L,17/17b54316.jpg,What material is used in the construction?,Hardwood,0
31wBeaL487L,17/17b54316.jpg,How many tables are in the set?,Three,1
31wBeaL487L,17/17b54316.jpg,What color is the finish?,Brown,0
31wBeaL487L,17/17b54316.jpg,What is the width of the smaller tables?,Twenty-two,1
31wBeaL487L,17/17b54316.jpg,What brand does it coordinate with?,Pinzon,0
71B-+kVkLiL,4e/4e00b580.jpg,What device model is this case designed for?,VIVO,1
71B-+kVkLiL,4e/4e00b580.jpg,What kind of cutouts are present?,Volume,0
71B-+kVkLiL,4e/4e00b580.jpg,What is the case's overall appearance?,Stylish,0
71B-+kVkLiL,4e/4e00b580.jpg,What protects the screen and camera?,Bezel,0
71B-+kVkLiL,4e/4e00b580.jpg,What type of surface is the back cover?,Hard,0
71SjXuX-1eL,83/834448f4.jpg,What material is the shoe made of?,Cotton,1
71SjXuX-1eL,83/834448f4.jpg,What kind of closure does the shoe have?,Lace-Up,0
71SjXuX-1eL,83/834448f4.jpg,What toe style is present?,Round,0
71SjXuX-1eL,83/834448f4.jpg,How long is the warranty period?,Ninety,1
71SjXuX-1eL,83/834448f4.jpg,What heel type does the shoe have?,Flats,0
81IE0rQYQcL,c1/c1f1c530.jpg,What is the primary color of the mask?,Azure,0
81IE0rQYQcL,c1/c1f1c530.jpg,What garment is the image depicting?,Mask,0
81IE0rQYQcL,c1/c1f1c530.jpg,Where does the mask cover on the face?,Mouth,1
81IE0rQYQcL,c1/c1f1c530.jpg,What is the texture of the fabric?,Smooth,0
81IE0rQYQcL,c1/c1f1c530.jpg,What is the shape of the bottom of the mask?,Triangle,1
61BI+JSb3UL,dd/dd34564c.jpg,What is the shape of the stone?,Square,0
61BI+JSb3UL,dd/dd34564c.jpg,What is the apparent color of the metal?,Silver,0
61BI+JSb3UL,dd/dd34564c.jpg,Where might these items be sourced from?,Imported,5
61BI+JSb3UL,dd/dd34564c.jpg,How many earrings are pictured?,Two,1
61BI+JSb3UL,dd/dd34564c.jpg,What enhances a gemstone's appeal?,Treatment,1
71Lwv+mrsNL,9a/9ad355f2.jpg,What brand of phone case is shown?,Nokia,1
71Lwv+mrsNL,9a/9ad355f2.jpg,What color is predominantly displayed on the case?,Purple,1
71Lwv+mrsNL,9a/9ad355f2.jpg,What type of material makes up the case?,Hard,1
71Lwv+mrsNL,9a/9ad355f2.jpg,What is printed on the back?,Canyon,1
71Lwv+mrsNL,9a/9ad355f2.jpg,Does this case come with warranty?,,1
61jhx-zcfIL,1c/1ca020d0.jpg,What type of outsole does this product have?,TR,0
61jhx-zcfIL,1c/1ca020d0.jpg,What material makes up the upper part?,Leather,1
61jhx-zcfIL,1c/1ca020d0.jpg,What padding is provided in the insole?,Latex,0
61jhx-zcfIL,1c/1ca020d0.jpg,What kind of wear is this designed for?,Daily,0
61jhx-zcfIL,1c/1ca020d0.jpg,What color is the slide?,Black,0
71-4FrtcwkL,e1/e182dc98.jpg,What brand is the phone case for?,Samsung,0
71-4FrtcwkL,e1/e182dc98.jpg,What color is the background?,Black,3
71-4FrtcwkL,e1/e182dc98.jpg,"What material is the ""happy"" text?",Glitter,0
71-4FrtcwkL,e1/e182dc98.jpg,How many hearts are visible?,Two,0
71-4FrtcwkL,e1/e182dc98.jpg,What does the bezel do?,Lifts,0
71ETUxv3nKL,f2/f243da7c.jpg,What color is the phone case?,Orange,0
71ETUxv3nKL,f2/f243da7c.jpg,Which brand phone is this cover for?,Vivo,0
71ETUxv3nKL,f2/f243da7c.jpg,What is the depicted design made from?,Chain,0
71ETUxv3nKL,f2/f243da7c.jpg,What feature has perfect cutouts?,Buttons,1
71ETUxv3nKL,f2/f243da7c.jpg,What material is the case?,Hard,3
71C+Oh++lXL,12/12137ad7.jpg,What brand of phone is this case designed for?,Vivo,0
71C+Oh++lXL,12/12137ad7.jpg,What is the case made of?,Unmentioned,0
71C+Oh++lXL,12/12137ad7.jpg,What feature is the case meant to protect besides the phone body?,Camera,0
71C+Oh++lXL,12/12137ad7.jpg,What is the design described as?,Stylish,1
71C+Oh++lXL,12/12137ad7.jpg,How many cameras are visible in the phone case image?,Two,0
71rEAVNm9tL,ef/ef6f070b.jpg,What animal is featured on the case?,Panda,0
71rEAVNm9tL,ef/ef6f070b.jpg,What material is the case constructed from?,Hard,1
71rEAVNm9tL,ef/ef6f070b.jpg,What brand of phone is this case designed for?,Lenovo,0
71rEAVNm9tL,ef/ef6f070b.jpg,What color is the primary design on the case?,Black,1
71rEAVNm9tL,ef/ef6f070b.jpg,How many camera holes are shown on the back?,One,0
71UXQra1r4L,3b/3bbf5ac4.jpg,What kind of closure does the shoe use?,Lace-Up,0
71UXQra1r4L,3b/3bbf5ac4.jpg,What is the heel type?,Cone,0
71UXQra1r4L,3b/3bbf5ac4.jpg,How many centimeters tall is the heel?,2.5,0
71UXQra1r4L,3b/3bbf5ac4.jpg,What material is the shoe's outer layer made of?,Synthetic,1
71UXQra1r4L,3b/3bbf5ac4.jpg,Where was this shoe manufactured?,India,5
81KmNHzGfVL,6c/6c792bbf.jpg,What color is the background?,Pink,0
81KmNHzGfVL,6c/6c792bbf.jpg,How many words are in the phrase on the case?,Two,1
81KmNHzGfVL,6c/6c792bbf.jpg,What type of device is this case for?,Phone,0
81KmNHzGfVL,6c/6c792bbf.jpg,What shape is the camera cutout?,Circle,0
81KmNHzGfVL,6c/6c792bbf.jpg,What is the case material?,,0
71IwJhDpdpL,f2/f2de457e.jpg,What brand is visible on the phone holder?,AmazonBasics,0
71IwJhDpdpL,f2/f2de457e.jpg,What is the primary color of the phone holder?,Black,0
71IwJhDpdpL,f2/f2de457e.jpg,What type of base is visible?,Suction,3
71IwJhDpdpL,f2/f2de457e.jpg,How many padded rectangles are on the center of the phone holder?,Three,0
71IwJhDpdpL,f2/f2de457e.jpg,What is the arm doing?,Bending,0
