image_id,path,question,answer,difficulty
81h2HdV36QL,69/69d95334.jpg,Who might receive this item as a gift?,Lover,0
81h2HdV36QL,69/69d95334.jpg,Where was this product made?,Abroad,0
71vkZMgP3oL,83/83edc032.jpg,What brand is the mobile device?,Apple,1
71vkZMgP3oL,83/83edc032.jpg,What material is the phone case made of?,Hard,0
71vkZMgP3oL,83/83edc032.jpg,What does the cover protect?,Back,1
71vkZMgP3oL,83/83edc032.jpg,How many generations of iPhone is this cover for?,One,0
71vkZMgP3oL,83/83edc032.jpg,What color are the leaves?,Green,1
810MsTpXdrL,38/38b1bc35.jpg,What material is the case made of?,Hard,0
810MsTpXdrL,38/38b1bc35.jpg,Which brand is the phone case for?,Nokia,1
810MsTpXdrL,38/38b1bc35.jpg,What kind of design does the case have?,Stylish,1
810MsTpXdrL,38/38b1bc35.jpg,What is the primary color of the phone case?,Gold,0
810MsTpXdrL,38/38b1bc35.jpg,How many cameras are visible on the phone case?,Two,0
71JVu8+2qVL,94/94e1fcec.jpg,What material is this phone case made of?,Hard,0
71JVu8+2qVL,94/94e1fcec.jpg,Which model is this case designed for?,Huawei,2
71JVu8+2qVL,94/94e1fcec.jpg,What year is the Y9 model from?,2019,0
71JVu8+2qVL,94/94e1fcec.jpg,What is this case designed to protect?,Camera,1
71JVu8+2qVL,94/94e1fcec.jpg,What adjective describes the design of this case?,Stylish,0
61ZQCeXeWbL,f8/f8247ac5.jpg,What material covers the bed's exterior?,Corduroy,0
61ZQCeXeWbL,f8/f8247ac5.jpg,What type of animal uses the product?,Pet,0
61ZQCeXeWbL,f8/f8247ac5.jpg,What adjective describes the bed's warmth?,Self-warming,1
61ZQCeXeWbL,f8/f8247ac5.jpg,What fabric lines the interior?,Fleece,0
61ZQCeXeWbL,f8/f8247ac5.jpg,How many forms of energy power the bed?,Zero,1
91e8ZgjZUPL,ee/eec0c9d8.jpg,What is the shade's shape?,Drum,0
91e8ZgjZUPL,ee/eec0c9d8.jpg,What material is the base?,Ceramic,2
91e8ZgjZUPL,ee/eec0c9d8.jpg,How tall is the lamp in inches?,22.75,0
91e8ZgjZUPL,ee/eec0c9d8.jpg,What adjective describes the lamp's style?,Modern,1
91e8ZgjZUPL,ee/eec0c9d8.jpg,What color is the lamp?,Grey,0
81Sxy2htnKL,35/35bdbb2a.jpg,What is the primary material of the back case?,Hard,0
81Sxy2htnKL,35/35bdbb2a.jpg,Which phone brand is this case designed for?,Samsung,0
81Sxy2htnKL,35/35bdbb2a.jpg,What color is the top rectangular area?,Yellow,0
81Sxy2htnKL,35/35bdbb2a.jpg,What is the printed style of the case?,Stylish,0
81Sxy2htnKL,35/35bdbb2a.jpg,How many warranty years does the case have?,Zero,0
81dMfjpcf2L,c1/c1f4765f.jpg,What fruit decorates the case?,Pineapple,0
81dMfjpcf2L,c1/c1f4765f.jpg,What is the case compatible with?,Vivo,0
81dMfjpcf2L,c1/c1f4765f.jpg,What kind of bezel does the case have?,Raised,1
81dMfjpcf2L,c1/c1f4765f.jpg,How many ports are mentioned in the description?,Three,0
81dMfjpcf2L,c1/c1f4765f.jpg,What personal attribute does the case express?,Personality,1
719k2A2YroL,be/be67831a.jpg,What brand is this mobile case for?,Nokia,2
719k2A2YroL,be/be67831a.jpg,What adjective describes the back cover?,Hard,2
719k2A2YroL,be/be67831a.jpg,What color is the rectangle near the bottom?,Red,0
719k2A2YroL,be/be67831a.jpg,How many dimensions is the design described as?,Three,0
719k2A2YroL,be/be67831a.jpg,What type of ports does it have cutouts for?,Charging,0
91kAH1FgnaL,87/87589e44.jpg,What vegetable is pictured on the packaging?,Asparagus,0
91kAH1FgnaL,87/87589e44.jpg,What company distributes this product?,Foods,0
91kAH1FgnaL,87/87589e44.jpg,What cooking time is highlighted on the bag?,Minutes,0
91kAH1FgnaL,87/87589e44.jpg,What vitamin is this product an excellent source of?,Vitamin,1
91kAH1FgnaL,87/87589e44.jpg,What additional ingredient is excluded from this product?,Salt,0
81Fl0rUJdaL,3c/3c0417c7.jpg,What brand is the case designed for?,LG,1
81Fl0rUJdaL,3c/3c0417c7.jpg,What is the case material?,Hard,0
81Fl0rUJdaL,3c/3c0417c7.jpg,What part of the phone does the case cover?,Back,0
81Fl0rUJdaL,3c/3c0417c7.jpg,What feature protects the screen and camera?,Bezel,0
81Fl0rUJdaL,3c/3c0417c7.jpg,What shape appears repeatedly on the case?,Hexagon,0
81yQ5N2fmYL,f5/f561b97a.jpg,What is the color of the bedding?,Gray,1
81yQ5N2fmYL,f5/f561b97a.jpg,What type of item is on top?,Pillow,0
81yQ5N2fmYL,f5/f561b97a.jpg,What is the texture of the bedding?,Striped,1
81yQ5N2fmYL,f5/f561b97a.jpg,What is the state of the duvet cover?,Folded,3
81yQ5N2fmYL,f5/f561b97a.jpg,What is the implied material?,Fabric,1
61DSPgHcYqL,dd/dd295da8.jpg,What is the compatible device for this case,Oppo,0
61DSPgHcYqL,dd/dd295da8.jpg,What kind of buttons have cut-outs,Volume,0
61DSPgHcYqL,dd/dd295da8.jpg,What type of ports have cut-outs,Charging,0
61DSPgHcYqL,dd/dd295da8.jpg,What quality describes the design,Stylish,0
61DSPgHcYqL,dd/dd295da8.jpg,What lifts the screen off the flat surface,Bezel,0
71FwdfCCikL,be/be4f07bf.jpg,What is the recommended maximum number of gallons before replacing the filter?,Threehundred,0
71FwdfCCikL,be/be4f07bf.jpg,What is the brand name on the water filter?,Amazonbasics,0
71FwdfCCikL,be/be4f07bf.jpg,What NSF/ANSI standard certifies lead-free compliance?,Threehundredseventytwo,0
71FwdfCCikL,be/be4f07bf.jpg,What is the recommended replacement time in months?,Six,0
71FwdfCCikL,be/be4f07bf.jpg,What filter type is used to trap contaminants?,Coconut,0
61a-w2dZLEL,21/213c4652.jpg,What material are the laces made of?,String,0
61a-w2dZLEL,21/213c4652.jpg,What is the shoe's main color?,Brown,0
61a-w2dZLEL,21/213c4652.jpg,What type of shoe is shown?,Boot,0
61a-w2dZLEL,21/213c4652.jpg,How many laces are visible?,Four,1
61a-w2dZLEL,21/213c4652.jpg,Where on the foot does the shoe end?,Ankle,0
7176sFBmYmL,b6/b64a2c0d.jpg,What material is the phone case made of?,Hard,0
7176sFBmYmL,b6/b64a2c0d.jpg,Which brand phone does the cover fit?,Lenovo,0
7176sFBmYmL,b6/b64a2c0d.jpg,What part of the phone does the case cover?,Back,0
7176sFBmYmL,b6/b64a2c0d.jpg,What type of design does the case have?,Stylish,0
7176sFBmYmL,b6/b64a2c0d.jpg,Which Vibe model is the case compatible with?,K5,0
61eK-RDCrqL,0e/0e4d09d5.jpg,What color is the phone case?,Black,0
61eK-RDCrqL,0e/0e4d09d5.jpg,What kind of flower is depicted?,Rose,0
61eK-RDCrqL,0e/0e4d09d5.jpg,Which body part is illustrated?,Skeleton,0
61eK-RDCrqL,0e/0e4d09d5.jpg,What material is the case made of?,Hard,1
61eK-RDCrqL,0e/0e4d09d5.jpg,What mobile brand is specified?,Asus,0
91cVoXabVyL,f5/f5494395.jpg,What is the apparent color of the metal?,Yellow,0
91cVoXabVyL,f5/f5494395.jpg,What shape are the prominent gems?,Square,1
91cVoXabVyL,f5/f5494395.jpg,How many rings are depicted?,Three,0
91cVoXabVyL,f5/f5494395.jpg,What is the ring's possible use?,Jewelry,0
91cVoXabVyL,f5/f5494395.jpg,What is the material composition's potential monetary value?,Expensive,0
81mw5lMgZZL,96/964af6b0.jpg,What material are the chair frames made of?,Aluminum,0
81mw5lMgZZL,96/964af6b0.jpg,What is the total number of chairs in the set?,Two,0
81mw5lMgZZL,96/964af6b0.jpg,What is the approximate weight of one chair?,Fifteen,0
81mw5lMgZZL,96/964af6b0.jpg,What is the seat cushion cover's fiber content?,Olefin,0
81mw5lMgZZL,96/964af6b0.jpg,What geometric symbol is on the chair back?,Cross,0
715wLgASHvL,8a/8aa2bb4f.jpg,What brand is the depicted phone case for?,LG,0
715wLgASHvL,8a/8aa2bb4f.jpg,What kind of cutouts are present on the case?,Volume,0
715wLgASHvL,8a/8aa2bb4f.jpg,What aesthetic quality does the design express?,Personality,0
715wLgASHvL,8a/8aa2bb4f.jpg,What is the product's form factor?,Cover,0
715wLgASHvL,8a/8aa2bb4f.jpg,What design feature protects the screen?,Bezel,0
61giB2SJP-L,17/176d014e.jpg,What brand makes the wet wipes?,SOLMO,0
61giB2SJP-L,17/176d014e.jpg,What fragrance are the wet wipes?,Cherry,0
61giB2SJP-L,17/176d014e.jpg,How many wipes are usable?,Thirty,0
61giB2SJP-L,17/176d014e.jpg,What is tested for normal skin?,Dermatologically,0
61giB2SJP-L,17/176d014e.jpg,What color are the rectangles on the packaging?,Pink,2
71FbNy4zE6L,ea/eae19b83.jpg,What brand is the phone case for?,Motorola,1
71FbNy4zE6L,ea/eae19b83.jpg,What color is the background of the phone case?,Yellow,0
71FbNy4zE6L,ea/eae19b83.jpg,How many shoes are depicted in the design?,Two,1
71FbNy4zE6L,ea/eae19b83.jpg,Which model is the phone case compatible with?,E3,1
71FbNy4zE6L,ea/eae19b83.jpg,What do the cutouts allow access to?,Buttons,0
71439JnzZLL,45/4574c412.jpg,What material is the case described as?,Hard,3
71439JnzZLL,45/4574c412.jpg,What brand of phone is this case for?,Apple,0
71439JnzZLL,45/4574c412.jpg,What feature does the case have to lift the screen?,Bezel,1
71439JnzZLL,45/4574c412.jpg,How many buttons are specifically mentioned with cutouts?,Volume,0
71439JnzZLL,45/4574c412.jpg,What appearance does the case have?,Stylish,0
91QIA-U2AfL,2e/2e368cd7.jpg,What is the warranty period offered?,Three,0
91QIA-U2AfL,2e/2e368cd7.jpg,What wood finish is on the bed frame?,Oak,0
91QIA-U2AfL,2e/2e368cd7.jpg,How many slats support the mattress?,Five,3
91QIA-U2AfL,2e/2e368cd7.jpg,How many minutes does it take to assemble the bed?,Thirty,0
91QIA-U2AfL,2e/2e368cd7.jpg,What shape adorns the headboard's design?,Chevron,0
71NBaWeca2L,f9/f9b365a5.jpg,What brand is the phone case designed for?,Samsung,0
71NBaWeca2L,f9/f9b365a5.jpg,What year is the described phone model from?,2016,0
71NBaWeca2L,f9/f9b365a5.jpg,What component is given easy access according to the design?,Camera,0
71NBaWeca2L,f9/f9b365a5.jpg,What feature is the design intended to express?,Personality,1
71NBaWeca2L,f9/f9b365a5.jpg,What color is dominant in the design of the phone case?,Blue,1
41XIE4PHBmL,7c/7cbed8a1.jpg,What is the main color of the storage box?,White,3
41XIE4PHBmL,7c/7cbed8a1.jpg,What encloses the seams of the box?,Trim,3
41XIE4PHBmL,7c/7cbed8a1.jpg,What is the shape of the container?,Rectangular,3
41XIE4PHBmL,7c/7cbed8a1.jpg,What is visible through the transparent panel?,Contents,0
41XIE4PHBmL,7c/7cbed8a1.jpg,What is the state of the fabric below the box?,Folded,0
619LgNDFUOL,ea/eacdc486.jpg,What is the color of the canopy?,Red,0
619LgNDFUOL,ea/eacdc486.jpg,What material is the canopy roof made of?,Fabric,1
619LgNDFUOL,ea/eacdc486.jpg,How many pegs are included for attaching the structure?,Eight,0
619LgNDFUOL,ea/eacdc486.jpg,What shape are the feet tubes?,Steel,0
619LgNDFUOL,ea/eacdc486.jpg,What measurement is the canopy top?,Eight,1
71NbmJcIf1L,6a/6a559835.jpg,What item is this?,Bathbomb,1
71NbmJcIf1L,6a/6a559835.jpg,What kind of milk is listed on the bath bomb?,Coconut,0
71NbmJcIf1L,6a/6a559835.jpg,What retail chain sells this product?,Wholefoods,1
71NbmJcIf1L,6a/6a559835.jpg,What is the body care described as?,Premium,0
71NbmJcIf1L,6a/6a559835.jpg,What color is the product's packaging?,White,0
71PyGY2FbjL,ef/ef309905.jpg,What brand of phone is the case designed for?,Vivo,1
71PyGY2FbjL,ef/ef309905.jpg,What color is the pattern on the case?,Golden,0
71PyGY2FbjL,ef/ef309905.jpg,What part of the phone is lifted off the surface by the raised bezel?,Screen,0
71PyGY2FbjL,ef/ef309905.jpg,What type of port has a cutout on the case?,Charging,0
71PyGY2FbjL,ef/ef309905.jpg,What type of closure does this case have?,Snug,0
81kZzR4R+aL,dc/dc8b4fbf.jpg,What is the chain's overall pattern name?,Figaro,1
81kZzR4R+aL,dc/dc8b4fbf.jpg,What is the material's apparent luster?,Metallic,0
81kZzR4R+aL,dc/dc8b4fbf.jpg,What is the chain's predominant color?,Silver,3
81kZzR4R+aL,dc/dc8b4fbf.jpg,What is being worn in this image?,Necklace,0
81kZzR4R+aL,dc/dc8b4fbf.jpg,How many long links are visible in the front center?,Two,0
51TUL54XSaL,62/62de5c2b.jpg,What color is the device?,Black,0
51TUL54XSaL,62/62de5c2b.jpg,What brand is printed on the device?,Amazonbasics,0
51TUL54XSaL,62/62de5c2b.jpg,What type of connector is sticking out?,HDMI,0
51TUL54XSaL,62/62de5c2b.jpg,What is the last digit of the customer service number?,Six,0
51TUL54XSaL,62/62de5c2b.jpg,What is one use case for this device?,Presentations,0
61zVt-HmRvL,81/8140d569.jpg,What scent is the air freshener?,Lavender,0
61zVt-HmRvL,81/8140d569.jpg,How many air fresheners are in a pack?,Six,0
61zVt-HmRvL,81/8140d569.jpg,What is the weight of each air freshener block?,Ten,1
61zVt-HmRvL,81/8140d569.jpg,What does the air freshener neutralize?,Odor,0
61zVt-HmRvL,81/8140d569.jpg,What word is written in a cursive font on the box?,Presto,1
71nrjugkhML,85/85053078.jpg,What is the primary color of the handle?,Beige,1
71nrjugkhML,85/85053078.jpg,What is the main use of this object?,Cleaning,1
71nrjugkhML,85/85053078.jpg,What is the color of the bristles?,Black,0
71nrjugkhML,85/85053078.jpg,What is the handle made of?,Plastic,1
71nrjugkhML,85/85053078.jpg,What is the overall shape of this tool?,Rectangular,1
71mpE3wdJXL,eb/eb9ef16e.jpg,What is the belt's color?,Black,0
71mpE3wdJXL,eb/eb9ef16e.jpg,What shape is the belt buckle?,Circular,0
71mpE3wdJXL,eb/eb9ef16e.jpg,What material is the buckle likely made of?,Metal,0
71mpE3wdJXL,eb/eb9ef16e.jpg,What apparel item uses this accessory?,Trousers,1
71mpE3wdJXL,eb/eb9ef16e.jpg,What texture appears on the belt?,Smooth,1
51Yr+1It1tL,72/7280ad1e.jpg,What color is the hub?,White,0
51Yr+1It1tL,72/7280ad1e.jpg,What type of port is on the end of the cable?,USB-C,0
51Yr+1It1tL,72/7280ad1e.jpg,What type of port is between the MicroSD and the USB ports?,VGA,0
51Yr+1It1tL,72/7280ad1e.jpg,What brand is written on the cable?,AmazonBasics,0
51Yr+1It1tL,72/7280ad1e.jpg,What type of port is on the far right?,USB,0
91oGeKQfTZL,ea/ea6a0b91.jpg,What kind of beans are in the bag?,Blackeye,1
91oGeKQfTZL,ea/ea6a0b91.jpg,What is the net weight of the beans?,500g,0
91oGeKQfTZL,ea/ea6a0b91.jpg,How many grams of protein are in 100g of the product?,Twenty-four,0
91oGeKQfTZL,ea/ea6a0b91.jpg,How many hours should the beans be soaked when cooking?,Twelve,0
91oGeKQfTZL,ea/ea6a0b91.jpg,Which market brand is shown?,WholeFoods,1
7175jjNiSWL,f3/f36f50a8.jpg,What scent is mentioned?,Citrus,0
7175jjNiSWL,f3/f36f50a8.jpg,What type of product is this?,Freshener,0
7175jjNiSWL,f3/f36f50a8.jpg,What weight is the Solimo Car Freshener Gel?,Forty,0
7175jjNiSWL,f3/f36f50a8.jpg,What is one available fragrance?,Rose,0
7175jjNiSWL,f3/f36f50a8.jpg,What is the brand name?,Solimo,0
71WBNACGseL,1e/1e69d1ee.jpg,What is the depicted case material?,Hard,2
71WBNACGseL,1e/1e69d1ee.jpg,Which phone brand is this case for?,Gionee,1
71WBNACGseL,1e/1e69d1ee.jpg,What feature are the cutouts for?,Buttons,1
71WBNACGseL,1e/1e69d1ee.jpg,What is the case's style?,Stylish,0
71WBNACGseL,1e/1e69d1ee.jpg,What kind of design allows access to buttons?,Precision,1
71EzGwBraEL,09/09e01425.jpg,What phone is the case designed for?,Samsung,0
71EzGwBraEL,09/09e01425.jpg,What is the case's fit?,Snug,0
71EzGwBraEL,09/09e01425.jpg,What color is dominant on the case?,Red,1
71EzGwBraEL,09/09e01425.jpg,What are the openings designed for?,Ports,1
71EzGwBraEL,09/09e01425.jpg,What feature is raised?,Bezel,0
71HRWgnV92L,e7/e71d9598.jpg,What material is the dustpan constructed from?,Polypropylene,0
71HRWgnV92L,e7/e71d9598.jpg,What type of spaces are these dustpans designed for?,Commercial,0
71HRWgnV92L,e7/e71d9598.jpg,How many dustpans are in the advertised pack?,Two,5
71HRWgnV92L,e7/e71d9598.jpg,What color is the handle?,Aluminum,0
71HRWgnV92L,e7/e71d9598.jpg,Where can these dustpans be stored using the hook hole?,Closet,1
81k14kn2ljL,7b/7badf7e7.jpg,What is the color of the suitcase?,Orange,0
81k14kn2ljL,7b/7badf7e7.jpg,What material is the handle made of?,Metal,0
81k14kn2ljL,7b/7badf7e7.jpg,How many wheels are on the suitcase?,Four,1
81k14kn2ljL,7b/7badf7e7.jpg,What geometric shape is visible on the suitcase surface?,Diamond,1
81k14kn2ljL,7b/7badf7e7.jpg,What device is found on the side?,Lock,0
71QzK0zoq8L,80/80df0cec.jpg,What material is the back case made of?,Hard,0
71QzK0zoq8L,80/80df0cec.jpg,What brand of phone is the case for?,Asus,2
71QzK0zoq8L,80/80df0cec.jpg,How many butterfly images are visible?,Two,1
71QzK0zoq8L,80/80df0cec.jpg,What shape are the ports cutout for?,Rectangular,0
71QzK0zoq8L,80/80df0cec.jpg,What is the overall style of the design?,Stylish,2
917+G9Z2W+L,e6/e6a85bb3.jpg,What color is the briefcase?,Brown,0
917+G9Z2W+L,e6/e6a85bb3.jpg,How many handles are visible?,One,0
917+G9Z2W+L,e6/e6a85bb3.jpg,What material appears to be the primary component?,Leather,1
917+G9Z2W+L,e6/e6a85bb3.jpg,What is the apparent function of the clasps?,Security,2
917+G9Z2W+L,e6/e6a85bb3.jpg,How many sections does the briefcase have?,Two,2
81PGUs3UeDL,62/62c8dace.jpg,What material is the back case made of?,Hard,1
81PGUs3UeDL,62/62c8dace.jpg,What brand of phone is the case designed for?,Lenovo,0
81PGUs3UeDL,62/62c8dace.jpg,What part of the phone has cutouts for buttons?,Volume,0
81PGUs3UeDL,62/62c8dace.jpg,What is the case's design described as?,Stylish,1
81PGUs3UeDL,62/62c8dace.jpg,What part of the phone is lifted off the flat surface?,Screen,0
61xw4lyu0iL,8c/8c77585c.jpg,What is the ring's primary material?,Metal,1
61xw4lyu0iL,8c/8c77585c.jpg,How many large stones are visible?,Three,0
61xw4lyu0iL,8c/8c77585c.jpg,What is the ring's overall shape?,Circular,1
61xw4lyu0iL,8c/8c77585c.jpg,What is the stone's perceived color?,Clear,0
61xw4lyu0iL,8c/8c77585c.jpg,What adjective describes the ring's band?,Smooth,0
81X3-HNV9cL,9a/9a0d46ec.jpg,What is the widest shelf's width?,Twenty,0
81X3-HNV9cL,9a/9a0d46ec.jpg,What is the MDF board thickness?,Eighteen,0
81X3-HNV9cL,9a/9a0d46ec.jpg,What is the color of the shelves?,Wenge,0
81X3-HNV9cL,9a/9a0d46ec.jpg,How many shelves are in the package?,Four,1
81X3-HNV9cL,9a/9a0d46ec.jpg,What is the weight capacity?,Three,0
81oN39W+DFL,6b/6b7cb3d5.jpg,What brand phone is the case designed for?,Asus,0
81oN39W+DFL,6b/6b7cb3d5.jpg,What style is the design described as?,Stylish,0
81oN39W+DFL,6b/6b7cb3d5.jpg,What part of the phone is protected by a raised bezel?,Camera,0
81oN39W+DFL,6b/6b7cb3d5.jpg,What material is the back case made of?,Hard,0
81oN39W+DFL,6b/6b7cb3d5.jpg,Which Zenfone is compatible?,Laser,0
71GqUn3Og+L,e8/e80825d4.jpg,What brand of phone case is described?,Lenovo,0
71GqUn3Og+L,e8/e80825d4.jpg,What two words are printed on the phone case?,GirlBoss,0
71GqUn3Og+L,e8/e80825d4.jpg,What color is the main body of the phone case?,Black,0
71GqUn3Og+L,e8/e80825d4.jpg,What material would describe the 'Girl Boss' words printed on the case?,Glittery,1
71GqUn3Og+L,e8/e80825d4.jpg,What kind of cut-outs are mentioned on the case?,Volume,2
713PAHzWqIL,b8/b8bbe3fe.jpg,What material is the back case?,Hard,0
713PAHzWqIL,b8/b8bbe3fe.jpg,What brand phone is the case for?,Samsung,0
713PAHzWqIL,b8/b8bbe3fe.jpg,What is the main color on the right?,Blue,1
713PAHzWqIL,b8/b8bbe3fe.jpg,What year is the phone model from?,2016,3
713PAHzWqIL,b8/b8bbe3fe.jpg,What is the case's intended purpose?,Protection,0
71eHj+tNyQL,d7/d7a4275c.jpg,What color is the background?,Pink,5
71eHj+tNyQL,d7/d7a4275c.jpg,What object is held by each bear?,Heart,0
71eHj+tNyQL,d7/d7a4275c.jpg,What brand is the mobile phone?,Samsung,0
71eHj+tNyQL,d7/d7a4275c.jpg,How is the case described?,Printed,1
71eHj+tNyQL,d7/d7a4275c.jpg,What shape are the red figures?,Hearts,0
61EpD10TWOL,a1/a1e005ce.jpg,What is the name of the wet wipe brand?,Solmo,0
61EpD10TWOL,a1/a1e005ce.jpg,What fragrance is listed on the packaging?,Breeze,0
61EpD10TWOL,a1/a1e005ce.jpg,How many usable wipes are in the package?,Thirty,0
61EpD10TWOL,a1/a1e005ce.jpg,What is the skin type that the wipes are tested for?,Normal,0
61EpD10TWOL,a1/a1e005ce.jpg,What vitamin is included for skin hydration?,Vitamin,0
71Iqn-08JuL,74/74f41eea.jpg,What shape is the ring's centerpiece?,Heart,0
71Iqn-08JuL,74/74f41eea.jpg,What precious metal is the ring made of?,Gold,1
71Iqn-08JuL,74/74f41eea.jpg,What are the small stones in the ring?,Diamonds,1
71Iqn-08JuL,74/74f41eea.jpg,What type of trim surrounds the diamond accents?,Milgrain,0
71Iqn-08JuL,74/74f41eea.jpg,What is assured for diamonds from suppliers?,Compliance,0
71GulXk63iL,92/927cb37c.jpg,What is the primary color of the case?,Orange,0
71GulXk63iL,92/927cb37c.jpg,What phone brand is this case for?,Xiaomi,0
71GulXk63iL,92/927cb37c.jpg,What material is the case described as?,Hard,0
71GulXk63iL,92/927cb37c.jpg,What component is used in the design?,Chain,1
71GulXk63iL,92/927cb37c.jpg,What part is lifted off a flat surface?,Camera,1
81jXMZRymyL,1f/1f9ca2a5.jpg,What shape composes the case's design?,Triangle,0
81jXMZRymyL,1f/1f9ca2a5.jpg,What color is the case's design?,Gray,0
81jXMZRymyL,1f/1f9ca2a5.jpg,How many camera holes are visible?,Two,1
81jXMZRymyL,1f/1f9ca2a5.jpg,What is the case material?,Hard,0
81jXMZRymyL,1f/1f9ca2a5.jpg,What type of device does the case fit?,Mobile,0
61X12UAYJoL,c2/c2b2eab4.jpg,What brand of phone is this case for?,Motorola,0
61X12UAYJoL,c2/c2b2eab4.jpg,What animal is represented on the case?,Cat,1
61X12UAYJoL,c2/c2b2eab4.jpg,What is the main color of the case?,Black,1
61X12UAYJoL,c2/c2b2eab4.jpg,How many volume buttons are mentioned?,One,0
61X12UAYJoL,c2/c2b2eab4.jpg,What word is printed beneath the ears?,Meow,2
816htVCThVL,49/4963a2cf.jpg,What material is the phone case made of?,Hard,0
816htVCThVL,49/4963a2cf.jpg,Which brand of phone is the case designed for?,Asus,0
816htVCThVL,49/4963a2cf.jpg,How many camera lenses are visible on the phone case?,Two,5
816htVCThVL,49/4963a2cf.jpg,What color is most prominent on the left side of the phone case?,Orange,0
816htVCThVL,49/4963a2cf.jpg,What feature does the description mention lifting off the surface?,Camera,1
71vD5Gb7a9L,14/144e45dd.jpg,What shape is the toe?,Pointed,0
71vD5Gb7a9L,14/144e45dd.jpg,What type of embellishment is present?,Frill,3
71vD5Gb7a9L,14/144e45dd.jpg,What part of the shoe is open?,Heel,1
71vD5Gb7a9L,14/144e45dd.jpg,What is the style of the shoe?,Mule,0
71vD5Gb7a9L,14/144e45dd.jpg,What material is likely used?,Suede,2
71vD9mdIxyL,33/3393e79f.jpg,What is the insole made of?,Foam,0
71vD9mdIxyL,33/3393e79f.jpg,What part of the slipper is shearling?,Lining,2
71vD9mdIxyL,33/3393e79f.jpg,What material is the sole?,Rubber,0
71vD9mdIxyL,33/3393e79f.jpg,What is the style of the shoe?,Slide,0
71vD9mdIxyL,33/3393e79f.jpg,What is the slipper's color?,Black,0
61yhsC7xo5L,79/793184d2.jpg,What phone model is the case designed for?,P9,0
61yhsC7xo5L,79/793184d2.jpg,What is the cover's primary color?,Black,1
61yhsC7xo5L,79/793184d2.jpg,What kind of cutouts does the case have?,Buttons,0
61yhsC7xo5L,79/793184d2.jpg,What is the case's design described as?,Stylish,0
61yhsC7xo5L,79/793184d2.jpg,What type of material is the back case?,Hard,1
7142wq1vkrL,34/348a39d6.jpg,What color is the pillow?,White,0
7142wq1vkrL,34/348a39d6.jpg,What is the primary material implied?,Fabric,1
7142wq1vkrL,34/348a39d6.jpg,What shape is the pillow?,Rectangular,0
7142wq1vkrL,34/348a39d6.jpg,Where is this likely placed?,Bedroom,0
7142wq1vkrL,34/348a39d6.jpg,What is the softness level implied?,Soft,1
711JLZ5uH+L,ba/ba25f5d6.jpg,What brand is the case designed for?,Asus,0
711JLZ5uH+L,ba/ba25f5d6.jpg,What material is the case made of?,Hard,0
711JLZ5uH+L,ba/ba25f5d6.jpg,What design is on the case?,Flowers,0
711JLZ5uH+L,ba/ba25f5d6.jpg,What color are the flowers?,Red,0
711JLZ5uH+L,ba/ba25f5d6.jpg,What is the model of the phone?,Zenfone,0
71uUMzeGnsL,85/85766a8c.jpg,What material is the back case made of?,Hard,1
71uUMzeGnsL,85/85766a8c.jpg,What brand of phone is the cover for?,Vivo,1
71uUMzeGnsL,85/85766a8c.jpg,What part of the phone does the bezel lift off the surface?,Camera,0
71uUMzeGnsL,85/85766a8c.jpg,What does the stylish design express?,Personality,1
71uUMzeGnsL,85/85766a8c.jpg,How many years of warranty does it have?,Zero,0
71mc7HP4ScL,b2/b2143a9b.jpg,What phone brand is the case for?,Samsung,0
71mc7HP4ScL,b2/b2143a9b.jpg,What image is on the case?,Skull,1
71mc7HP4ScL,b2/b2143a9b.jpg,How are buttons accessed?,Cutouts,1
71mc7HP4ScL,b2/b2143a9b.jpg,What color is one side of the case?,Red,0
71mc7HP4ScL,b2/b2143a9b.jpg,What feature lifts the camera?,Bezel,0
81QoSTOvuUL,d7/d746d6f0.jpg,What word is written on the cover?,Queen,1
81QoSTOvuUL,d7/d746d6f0.jpg,What color is the phone case?,Red,0
81QoSTOvuUL,d7/d746d6f0.jpg,What type of phone is the cover for?,Motorola,0
81QoSTOvuUL,d7/d746d6f0.jpg,What is the case material?,Hard,1
81QoSTOvuUL,d7/d746d6f0.jpg,Where are the cutouts located?,Ports,1
81z+3WP27gL,93/93d7b9ec.jpg,What is the sofa's style?,Classic,0
81z+3WP27gL,93/93d7b9ec.jpg,What is the height of the sofa?,37.5,1
81z+3WP27gL,93/93d7b9ec.jpg,How many years is the warranty?,Three,0
81z+3WP27gL,93/93d7b9ec.jpg,What type of fabric is used?,Polyester,1
81z+3WP27gL,93/93d7b9ec.jpg,What is the sofa's width?,76,0
81iainDTczL,bd/bd6f83c4.jpg,What material are the drawer pulls made from?,Metal,1
81iainDTczL,bd/bd6f83c4.jpg,What is the color of the furniture's finish?,Navy,2
81iainDTczL,bd/bd6f83c4.jpg,How many days are offered for free returns?,Thirty,1
81iainDTczL,bd/bd6f83c4.jpg,How many drawers does the furniture have?,Four,0
81iainDTczL,bd/bd6f83c4.jpg,What is the furniture's depth in inches?,Eighteen,0
71IzF6gHVGL,18/18d4a643.jpg,What food item is on the phone case?,Corn,1
71IzF6gHVGL,18/18d4a643.jpg,Which phone brand is this case for?,Samsung,1
71IzF6gHVGL,18/18d4a643.jpg,What is the case described as being?,Hard,0
71IzF6gHVGL,18/18d4a643.jpg,What part of the phone does the case cover?,Back,0
71IzF6gHVGL,18/18d4a643.jpg,What color is the corn?,Yellow,1
61TznxNd6nL,1c/1c5ae623.jpg,What material is the mobile cover made of?,Hard,0
61TznxNd6nL,1c/1c5ae623.jpg,What brand is the phone case designed for?,Motorola,0
61TznxNd6nL,1c/1c5ae623.jpg,What is the background color of the case?,Black,1
61TznxNd6nL,1c/1c5ae623.jpg,What is the design printed on the case depicting?,Couple,2
61TznxNd6nL,1c/1c5ae623.jpg,What is the type of bezel around the camera?,Raised,1
818GO2C8L9L,e8/e884085c.jpg,What brand is this phone case for?,Gionee,0
818GO2C8L9L,e8/e884085c.jpg,What feature does the raised bezel protect?,Camera,0
818GO2C8L9L,e8/e884085c.jpg,What material is the case made from?,Hard,1
818GO2C8L9L,e8/e884085c.jpg,How many dimensions are implied in the product title?,Three,0
